{
    "componentChunkName": "component---node-modules-rocketseat-gatsby-theme-docs-core-src-templates-docs-query-js",
    "path": "/templates",
    "result": {"data":{"mdx":{"id":"9ff49470-688e-5964-826e-2de06b280d3f","excerpt":"Deneb has a number of built-in templates that are available from the  Create New Specification  dialog. This is demonstrated in the  Simple Worked Example  whenâ€¦","fields":{"slug":"/templates/"},"frontmatter":{"title":"Working With Templates","description":"Working with templates in Deneb","image":"/images/favicon.png","disableTableOfContents":false},"body":"var _excluded = [\"components\"];\n\nfunction _extends() { _extends = Object.assign || function (target) { for (var i = 1; i < arguments.length; i++) { var source = arguments[i]; for (var key in source) { if (Object.prototype.hasOwnProperty.call(source, key)) { target[key] = source[key]; } } } return target; }; return _extends.apply(this, arguments); }\n\nfunction _objectWithoutProperties(source, excluded) { if (source == null) return {}; var target = _objectWithoutPropertiesLoose(source, excluded); var key, i; if (Object.getOwnPropertySymbols) { var sourceSymbolKeys = Object.getOwnPropertySymbols(source); for (i = 0; i < sourceSymbolKeys.length; i++) { key = sourceSymbolKeys[i]; if (excluded.indexOf(key) >= 0) continue; if (!Object.prototype.propertyIsEnumerable.call(source, key)) continue; target[key] = source[key]; } } return target; }\n\nfunction _objectWithoutPropertiesLoose(source, excluded) { if (source == null) return {}; var target = {}; var sourceKeys = Object.keys(source); var key, i; for (i = 0; i < sourceKeys.length; i++) { key = sourceKeys[i]; if (excluded.indexOf(key) >= 0) continue; target[key] = source[key]; } return target; }\n\n/* @jsxRuntime classic */\n\n/* @jsx mdx */\nvar _frontmatter = {\n  \"title\": \"Working With Templates\",\n  \"description\": \"Working with templates in Deneb\",\n  \"image\": \"/images/favicon.png\",\n  \"disableTableOfContents\": false\n};\nvar layoutProps = {\n  _frontmatter: _frontmatter\n};\nvar MDXLayout = \"wrapper\";\nreturn function MDXContent(_ref) {\n  var components = _ref.components,\n      props = _objectWithoutProperties(_ref, _excluded);\n\n  return mdx(MDXLayout, _extends({}, layoutProps, props, {\n    components: components,\n    mdxType: \"MDXLayout\"\n  }), mdx(\"p\", null, \"Deneb has a number of built-in templates that are available from the \", mdx(\"em\", {\n    parentName: \"p\"\n  }, \"Create New Specification\"), \" dialog. This is demonstrated in the \", mdx(\"a\", {\n    parentName: \"p\",\n    \"href\": \"/simple-worked-example#selecting-the-template\"\n  }, \"Simple Worked Example\"), \" when we create our first chart.\"), mdx(\"p\", null, \"Of course, we can't capture everything in these templates and they're really to help you in getting started. You are able to generate your own, or import those generated by others.\"), mdx(\"h2\", {\n    \"id\": \"importing-a-template-\",\n    \"style\": {\n      \"position\": \"relative\"\n    }\n  }, mdx(\"a\", {\n    parentName: \"h2\",\n    \"href\": \"#importing-a-template-\",\n    \"aria-label\": \"importing a template  permalink\",\n    \"className\": \"anchor before\"\n  }, mdx(\"svg\", {\n    parentName: \"a\",\n    \"aria-hidden\": \"true\",\n    \"focusable\": \"false\",\n    \"height\": \"16\",\n    \"version\": \"1.1\",\n    \"viewBox\": \"0 0 16 16\",\n    \"width\": \"16\"\n  }, mdx(\"path\", {\n    parentName: \"svg\",\n    \"fillRule\": \"evenodd\",\n    \"d\": \"M4 9h1v1H4c-1.5 0-3-1.69-3-3.5S2.55 3 4 3h4c1.45 0 3 1.69 3 3.5 0 1.41-.91 2.72-2 3.25V8.59c.58-.45 1-1.27 1-2.09C10 5.22 8.98 4 8 4H4c-.98 0-2 1.22-2 2.5S3 9 4 9zm9-3h-1v1h1c1 0 2 1.22 2 2.5S13.98 12 13 12H9c-.98 0-2-1.22-2-2.5 0-.83.42-1.64 1-2.09V6.25c-1.09.53-2 1.84-2 3.25C6 11.31 7.55 13 9 13h4c1.45 0 3-1.69 3-3.5S14.5 6 13 6z\"\n  }))), \"Importing a Template \", mdx(\"img\", {\n    parentName: \"h2\",\n    \"src\": \"https://img.shields.io/badge/-%E2%89%A5%200.3-lightgrey\",\n    \"alt\": null\n  })), mdx(\"p\", null, \"Much like creating from an inbuilt template, to import a template you will need to ensure that you have at least one column or measure in your visual's dataset so that the advanced editor can be accessed.\"), mdx(\"p\", null, \"In the advanced editor's \", mdx(\"em\", {\n    parentName: \"p\"\n  }, \"Create New Specification\"), \" dialog, you have the option to import a template, e.g.:\"), mdx(\"p\", null, mdx(\"img\", {\n    parentName: \"p\",\n    \"src\": \"/images/templates/import-template-location.png\",\n    \"alt\": \"import-template-location.png\",\n    \"title\": \"The 'Import Template' option can be found in the 'Create New Specification' dialog in Deneb's advanced editor.\"\n  })), mdx(\"p\", null, \"Navigate to or click \", mdx(\"em\", {\n    parentName: \"p\"\n  }, \"Select JSON Template\"), \", browse to your template's \", mdx(\"inlineCode\", {\n    parentName: \"p\"\n  }, \".json\"), \" file and click open, e.g.:\"), mdx(\"p\", null, mdx(\"img\", {\n    parentName: \"p\",\n    \"src\": \"/images/templates/browse-and-open.png\",\n    \"alt\": \"browse-and-open.png\",\n    \"title\": \"Use the 'Open File' dialog to navigate to a .json file and select 'Open'.\"\n  })), mdx(\"h3\", {\n    \"id\": \"dataset-placeholders\",\n    \"style\": {\n      \"position\": \"relative\"\n    }\n  }, mdx(\"a\", {\n    parentName: \"h3\",\n    \"href\": \"#dataset-placeholders\",\n    \"aria-label\": \"dataset placeholders permalink\",\n    \"className\": \"anchor before\"\n  }, mdx(\"svg\", {\n    parentName: \"a\",\n    \"aria-hidden\": \"true\",\n    \"focusable\": \"false\",\n    \"height\": \"16\",\n    \"version\": \"1.1\",\n    \"viewBox\": \"0 0 16 16\",\n    \"width\": \"16\"\n  }, mdx(\"path\", {\n    parentName: \"svg\",\n    \"fillRule\": \"evenodd\",\n    \"d\": \"M4 9h1v1H4c-1.5 0-3-1.69-3-3.5S2.55 3 4 3h4c1.45 0 3 1.69 3 3.5 0 1.41-.91 2.72-2 3.25V8.59c.58-.45 1-1.27 1-2.09C10 5.22 8.98 4 8 4H4c-.98 0-2 1.22-2 2.5S3 9 4 9zm9-3h-1v1h1c1 0 2 1.22 2 2.5S13.98 12 13 12H9c-.98 0-2-1.22-2-2.5 0-.83.42-1.64 1-2.09V6.25c-1.09.53-2 1.84-2 3.25C6 11.31 7.55 13 9 13h4c1.45 0 3-1.69 3-3.5S14.5 6 13 6z\"\n  }))), \"Dataset Placeholders\"), mdx(\"p\", null, \"The selected file's JSON will be validated and if successful, the placeholder information will be displayed, e.g.:\"), mdx(\"p\", null, mdx(\"img\", {\n    parentName: \"p\",\n    \"src\": \"/images/templates/import-template-details-initial.png\",\n    \"alt\": \"import-template-details-initial.png\",\n    \"title\": \"Valid templates will provide options for the user to bind their dataset to template placeholders.\"\n  })), mdx(\"blockquote\", null, mdx(\"p\", {\n    parentName: \"blockquote\"\n  }, mdx(\"em\", {\n    parentName: \"p\"\n  }, \"Only valid Deneb templates can be imported. If you're looking to add a Vega or Vega-Lite specification from elsewhere, it's better to create a blank template for the appropriate provider. Then, paste this into the editor and correct it directly, or manually add the appropriate metadata required for Deneb and then import. \", mdx(\"a\", {\n    parentName: \"em\",\n    \"href\": \"#template-structure\"\n  }, \"Refer below\"), \" for more detail on this.\"))), mdx(\"p\", null, \"For each placeholder, the suggested data type (that the author used in their dataset) is shown next to the name.\"), mdx(\"p\", null, \"You are not restricted to choosing columns or measures of the the same data type, but it is likely that your results may vary if you do choose a different one to the author's design. The only restriction is that columns and measures cannot be used interchangeably, and these are greyed-out and disabled accordingly.\"), mdx(\"p\", null, \"If the author decided to enter a description for the placeholder, this can be viewed by interacting with the information icon next to it.\"), mdx(\"h3\", {\n    \"id\": \"populating-placeholders\",\n    \"style\": {\n      \"position\": \"relative\"\n    }\n  }, mdx(\"a\", {\n    parentName: \"h3\",\n    \"href\": \"#populating-placeholders\",\n    \"aria-label\": \"populating placeholders permalink\",\n    \"className\": \"anchor before\"\n  }, mdx(\"svg\", {\n    parentName: \"a\",\n    \"aria-hidden\": \"true\",\n    \"focusable\": \"false\",\n    \"height\": \"16\",\n    \"version\": \"1.1\",\n    \"viewBox\": \"0 0 16 16\",\n    \"width\": \"16\"\n  }, mdx(\"path\", {\n    parentName: \"svg\",\n    \"fillRule\": \"evenodd\",\n    \"d\": \"M4 9h1v1H4c-1.5 0-3-1.69-3-3.5S2.55 3 4 3h4c1.45 0 3 1.69 3 3.5 0 1.41-.91 2.72-2 3.25V8.59c.58-.45 1-1.27 1-2.09C10 5.22 8.98 4 8 4H4c-.98 0-2 1.22-2 2.5S3 9 4 9zm9-3h-1v1h1c1 0 2 1.22 2 2.5S13.98 12 13 12H9c-.98 0-2-1.22-2-2.5 0-.83.42-1.64 1-2.09V6.25c-1.09.53-2 1.84-2 3.25C6 11.31 7.55 13 9 13h4c1.45 0 3-1.69 3-3.5S14.5 6 13 6z\"\n  }))), \"Populating Placeholders\"), mdx(\"p\", null, \"Click or expand a placeholder's dropdown list to select an appropriate column or measure from your dataset, e.g.:\"), mdx(\"p\", null, mdx(\"img\", {\n    parentName: \"p\",\n    \"src\": \"/images/templates/import-placeholder-expand.png\",\n    \"alt\": \"import-placeholder-expand.png\",\n    \"title\": \"Opening the dropdown list for a placeholder shows available columns or measures and their data type.\"\n  })), mdx(\"p\", null, \"The data type for each column and measure is shown next to it, so that you can quickly identify eligible candidates. If a suitable candidate does not exist, you can add new columns or measures from the data model and the details in the dropdown list will update to match.\"), mdx(\"p\", null, \"Once all placeholders have been assigned, the \", mdx(\"em\", {\n    parentName: \"p\"\n  }, \"Create\"), \" button is enabled, e.g.:\"), mdx(\"p\", null, mdx(\"img\", {\n    parentName: \"p\",\n    \"src\": \"/images/templates/import-placeholders-assigned.png\",\n    \"alt\": \"import-placeholders-assigned.png\",\n    \"title\": \"Once all placeholders have been assigned, the 'Create' button is enabled.\"\n  })), mdx(\"blockquote\", null, mdx(\"p\", {\n    parentName: \"blockquote\"\n  }, mdx(\"em\", {\n    parentName: \"p\"\n  }, \"If you have anything from your dataset that is unassigned, (particularly columns), it is recommended that you remove them, in order to preserve the cardinality or row context that the template author orginally intended.\"))), mdx(\"p\", null, \"Selecting the \", mdx(\"em\", {\n    parentName: \"p\"\n  }, \"Create\"), \" button will then add the template to the advanced editor, with all placeholders filled-out as specified, e.g.:\"), mdx(\"p\", null, mdx(\"img\", {\n    parentName: \"p\",\n    \"src\": \"/images/templates/import-template-complete.png\",\n    \"alt\": \"import-template-complete.png\",\n    \"title\": \"Your specification is created from the template, with all placeholders assigned.\"\n  })), mdx(\"p\", null, \"Everyone's data is different, so it is highly likely that you'll need to make further tweaks to the specification to make it suit your particular scenario, but otherwise you're good to go! \\uD83D\\uDE04\"), mdx(\"h2\", {\n    \"id\": \"generating-a-template-\",\n    \"style\": {\n      \"position\": \"relative\"\n    }\n  }, mdx(\"a\", {\n    parentName: \"h2\",\n    \"href\": \"#generating-a-template-\",\n    \"aria-label\": \"generating a template  permalink\",\n    \"className\": \"anchor before\"\n  }, mdx(\"svg\", {\n    parentName: \"a\",\n    \"aria-hidden\": \"true\",\n    \"focusable\": \"false\",\n    \"height\": \"16\",\n    \"version\": \"1.1\",\n    \"viewBox\": \"0 0 16 16\",\n    \"width\": \"16\"\n  }, mdx(\"path\", {\n    parentName: \"svg\",\n    \"fillRule\": \"evenodd\",\n    \"d\": \"M4 9h1v1H4c-1.5 0-3-1.69-3-3.5S2.55 3 4 3h4c1.45 0 3 1.69 3 3.5 0 1.41-.91 2.72-2 3.25V8.59c.58-.45 1-1.27 1-2.09C10 5.22 8.98 4 8 4H4c-.98 0-2 1.22-2 2.5S3 9 4 9zm9-3h-1v1h1c1 0 2 1.22 2 2.5S13.98 12 13 12H9c-.98 0-2-1.22-2-2.5 0-.83.42-1.64 1-2.09V6.25c-1.09.53-2 1.84-2 3.25C6 11.31 7.55 13 9 13h4c1.45 0 3-1.69 3-3.5S14.5 6 13 6z\"\n  }))), \"Generating a Template \", mdx(\"img\", {\n    parentName: \"h2\",\n    \"src\": \"https://img.shields.io/badge/-%E2%89%A5%200.3-lightgrey\",\n    \"alt\": null\n  })), mdx(\"blockquote\", null, mdx(\"p\", {\n    parentName: \"blockquote\"\n  }, mdx(\"em\", {\n    parentName: \"p\"\n  }, mdx(\"strong\", {\n    parentName: \"em\"\n  }, \"Power BI visuals are not currently permitted to save/download files directly\"), \", so this functionality is the best we can manage at present.\"))), mdx(\"p\", null, \"If you're happy with a specification and wish to share with others, or take a copy for re-use or source control, it is possible to 'export' a template.\"), mdx(\"p\", null, \"In the advanced editor, select the \", mdx(\"a\", {\n    parentName: \"p\",\n    \"href\": \"/visual-editor#generate-json-template\"\n  }, mdx(\"em\", {\n    parentName: \"a\"\n  }, \"Generate JSON Template\")), \" command. This will open the dialog.\"), mdx(\"h3\", {\n    \"id\": \"template-information\",\n    \"style\": {\n      \"position\": \"relative\"\n    }\n  }, mdx(\"a\", {\n    parentName: \"h3\",\n    \"href\": \"#template-information\",\n    \"aria-label\": \"template information permalink\",\n    \"className\": \"anchor before\"\n  }, mdx(\"svg\", {\n    parentName: \"a\",\n    \"aria-hidden\": \"true\",\n    \"focusable\": \"false\",\n    \"height\": \"16\",\n    \"version\": \"1.1\",\n    \"viewBox\": \"0 0 16 16\",\n    \"width\": \"16\"\n  }, mdx(\"path\", {\n    parentName: \"svg\",\n    \"fillRule\": \"evenodd\",\n    \"d\": \"M4 9h1v1H4c-1.5 0-3-1.69-3-3.5S2.55 3 4 3h4c1.45 0 3 1.69 3 3.5 0 1.41-.91 2.72-2 3.25V8.59c.58-.45 1-1.27 1-2.09C10 5.22 8.98 4 8 4H4c-.98 0-2 1.22-2 2.5S3 9 4 9zm9-3h-1v1h1c1 0 2 1.22 2 2.5S13.98 12 13 12H9c-.98 0-2-1.22-2-2.5 0-.83.42-1.64 1-2.09V6.25c-1.09.53-2 1.84-2 3.25C6 11.31 7.55 13 9 13h4c1.45 0 3-1.69 3-3.5S14.5 6 13 6z\"\n  }))), \"Template Information\"), mdx(\"p\", null, mdx(\"img\", {\n    parentName: \"p\",\n    \"src\": \"/images/templates/export-enter-template-information.png\",\n    \"alt\": \"export-enter-template-information.png\",\n    \"title\": \"The 'Generate JSON Template' dialog allows you to create and customize a version of your specification that is suitable for sharing.\"\n  })), mdx(\"p\", null, \"In the first tab, fill in a suitable, descriptive name for the template and a more detailed description. This will be displayed to any users when importing it and should help then with filling it in. The author details are currently not shown on import, but will be later on.\"), mdx(\"h3\", {\n    \"id\": \"template-information-1\",\n    \"style\": {\n      \"position\": \"relative\"\n    }\n  }, mdx(\"a\", {\n    parentName: \"h3\",\n    \"href\": \"#template-information-1\",\n    \"aria-label\": \"template information 1 permalink\",\n    \"className\": \"anchor before\"\n  }, mdx(\"svg\", {\n    parentName: \"a\",\n    \"aria-hidden\": \"true\",\n    \"focusable\": \"false\",\n    \"height\": \"16\",\n    \"version\": \"1.1\",\n    \"viewBox\": \"0 0 16 16\",\n    \"width\": \"16\"\n  }, mdx(\"path\", {\n    parentName: \"svg\",\n    \"fillRule\": \"evenodd\",\n    \"d\": \"M4 9h1v1H4c-1.5 0-3-1.69-3-3.5S2.55 3 4 3h4c1.45 0 3 1.69 3 3.5 0 1.41-.91 2.72-2 3.25V8.59c.58-.45 1-1.27 1-2.09C10 5.22 8.98 4 8 4H4c-.98 0-2 1.22-2 2.5S3 9 4 9zm9-3h-1v1h1c1 0 2 1.22 2 2.5S13.98 12 13 12H9c-.98 0-2-1.22-2-2.5 0-.83.42-1.64 1-2.09V6.25c-1.09.53-2 1.84-2 3.25C6 11.31 7.55 13 9 13h4c1.45 0 3-1.69 3-3.5S14.5 6 13 6z\"\n  }))), \"Template Information\"), mdx(\"p\", null, \"In the second tab, you have the opportunity to customize your dataset requirements for your users:\"), mdx(\"p\", null, mdx(\"img\", {\n    parentName: \"p\",\n    \"src\": \"/images/templates/export-enter-dataset-information.png\",\n    \"alt\": \"export-enter-dataset-information.png\",\n    \"title\": \"The second tab allows you to rename and describe your dataset columns and measures for the shared template.\"\n  })), mdx(\"blockquote\", null, mdx(\"p\", {\n    parentName: \"blockquote\"\n  }, mdx(\"em\", {\n    parentName: \"p\"\n  }, \"Deneb assumes all columns and measures from your dataset are required. If any columns or measures are superfluous to the template, you should remove them from the \", mdx(\"strong\", {\n    parentName: \"em\"\n  }, \"Values\"), \" data role so that they also get removed from this part of the dialog. This will ensure that they aren't included for your end users and cause potential side-effects or ambiguity as to how they should be used.\"))), mdx(\"p\", null, \"Each dataset field has a text box that you can use to rename the placeholder to something more general-purpose for your template. This is also particularly useful if your names might be sensitive. It's recommended to try and use specific terms so this helps to document your template for end users.\"), mdx(\"p\", null, \"If you leave a box empty or delete its contents the original name from your dataset will be used. This can also be seen underneath the box for comparison purposes.\"), mdx(\"p\", null, \"Each field has an optional description. In here, you can type more information for your end users, should it be required. This description will be displayed in the information box next to the field placeholder when used for import.\"), mdx(\"h3\", {\n    \"id\": \"review-and-copy-to-clipboard\",\n    \"style\": {\n      \"position\": \"relative\"\n    }\n  }, mdx(\"a\", {\n    parentName: \"h3\",\n    \"href\": \"#review-and-copy-to-clipboard\",\n    \"aria-label\": \"review and copy to clipboard permalink\",\n    \"className\": \"anchor before\"\n  }, mdx(\"svg\", {\n    parentName: \"a\",\n    \"aria-hidden\": \"true\",\n    \"focusable\": \"false\",\n    \"height\": \"16\",\n    \"version\": \"1.1\",\n    \"viewBox\": \"0 0 16 16\",\n    \"width\": \"16\"\n  }, mdx(\"path\", {\n    parentName: \"svg\",\n    \"fillRule\": \"evenodd\",\n    \"d\": \"M4 9h1v1H4c-1.5 0-3-1.69-3-3.5S2.55 3 4 3h4c1.45 0 3 1.69 3 3.5 0 1.41-.91 2.72-2 3.25V8.59c.58-.45 1-1.27 1-2.09C10 5.22 8.98 4 8 4H4c-.98 0-2 1.22-2 2.5S3 9 4 9zm9-3h-1v1h1c1 0 2 1.22 2 2.5S13.98 12 13 12H9c-.98 0-2-1.22-2-2.5 0-.83.42-1.64 1-2.09V6.25c-1.09.53-2 1.84-2 3.25C6 11.31 7.55 13 9 13h4c1.45 0 3-1.69 3-3.5S14.5 6 13 6z\"\n  }))), \"Review and Copy to Clipboard\"), mdx(\"p\", null, \"In the final tab, you will see what the JSON for your generated template will look like, including the Deneb-specific metadata:\"), mdx(\"p\", null, mdx(\"img\", {\n    parentName: \"p\",\n    \"src\": \"/images/templates/export-review-template-content.png\",\n    \"alt\": \"export-review-template-content.png\",\n    \"title\": \"The final tab allows you to review your specification template and copy it to the clipboard.\"\n  })), mdx(\"p\", null, \"You cannot modify the data in this box, so if there are aspects of the template that you need to change, then you will need to edit in the appropriate place:\"), mdx(\"ul\", null, mdx(\"li\", {\n    parentName: \"ul\"\n  }, \"For the specification and config, this needs to be done in the main editors.\"), mdx(\"li\", {\n    parentName: \"ul\"\n  }, \"For the placeholders, navigate back to the appropriate tab and correct information accordingly.\")), mdx(\"p\", null, \"When ready, you can either click the \", mdx(\"em\", {\n    parentName: \"p\"\n  }, \"Copy\"), \" button to the right of the dialog, or manually select the template text and copy it with \", mdx(\"em\", {\n    parentName: \"p\"\n  }, \"[ Ctrl + C ]\"), \".\"), mdx(\"h3\", {\n    \"id\": \"saving-the-template-file\",\n    \"style\": {\n      \"position\": \"relative\"\n    }\n  }, mdx(\"a\", {\n    parentName: \"h3\",\n    \"href\": \"#saving-the-template-file\",\n    \"aria-label\": \"saving the template file permalink\",\n    \"className\": \"anchor before\"\n  }, mdx(\"svg\", {\n    parentName: \"a\",\n    \"aria-hidden\": \"true\",\n    \"focusable\": \"false\",\n    \"height\": \"16\",\n    \"version\": \"1.1\",\n    \"viewBox\": \"0 0 16 16\",\n    \"width\": \"16\"\n  }, mdx(\"path\", {\n    parentName: \"svg\",\n    \"fillRule\": \"evenodd\",\n    \"d\": \"M4 9h1v1H4c-1.5 0-3-1.69-3-3.5S2.55 3 4 3h4c1.45 0 3 1.69 3 3.5 0 1.41-.91 2.72-2 3.25V8.59c.58-.45 1-1.27 1-2.09C10 5.22 8.98 4 8 4H4c-.98 0-2 1.22-2 2.5S3 9 4 9zm9-3h-1v1h1c1 0 2 1.22 2 2.5S13.98 12 13 12H9c-.98 0-2-1.22-2-2.5 0-.83.42-1.64 1-2.09V6.25c-1.09.53-2 1.84-2 3.25C6 11.31 7.55 13 9 13h4c1.45 0 3-1.69 3-3.5S14.5 6 13 6z\"\n  }))), \"Saving the Template File\"), mdx(\"p\", null, \"Paste the template into your editor of choice and name it with an extension of \", mdx(\"inlineCode\", {\n    parentName: \"p\"\n  }, \".json\"), \". For our example, I've used \", mdx(\"inlineCode\", {\n    parentName: \"p\"\n  }, \"line-label-series.json\"), \" and this can be seen in the \", mdx(\"a\", {\n    parentName: \"p\",\n    \"href\": \"#importing-a-template\"\n  }, \"Importing example above\"), \".\"), mdx(\"h2\", {\n    \"id\": \"template-structure-\",\n    \"style\": {\n      \"position\": \"relative\"\n    }\n  }, mdx(\"a\", {\n    parentName: \"h2\",\n    \"href\": \"#template-structure-\",\n    \"aria-label\": \"template structure  permalink\",\n    \"className\": \"anchor before\"\n  }, mdx(\"svg\", {\n    parentName: \"a\",\n    \"aria-hidden\": \"true\",\n    \"focusable\": \"false\",\n    \"height\": \"16\",\n    \"version\": \"1.1\",\n    \"viewBox\": \"0 0 16 16\",\n    \"width\": \"16\"\n  }, mdx(\"path\", {\n    parentName: \"svg\",\n    \"fillRule\": \"evenodd\",\n    \"d\": \"M4 9h1v1H4c-1.5 0-3-1.69-3-3.5S2.55 3 4 3h4c1.45 0 3 1.69 3 3.5 0 1.41-.91 2.72-2 3.25V8.59c.58-.45 1-1.27 1-2.09C10 5.22 8.98 4 8 4H4c-.98 0-2 1.22-2 2.5S3 9 4 9zm9-3h-1v1h1c1 0 2 1.22 2 2.5S13.98 12 13 12H9c-.98 0-2-1.22-2-2.5 0-.83.42-1.64 1-2.09V6.25c-1.09.53-2 1.84-2 3.25C6 11.31 7.55 13 9 13h4c1.45 0 3-1.69 3-3.5S14.5 6 13 6z\"\n  }))), \"Template Structure \", mdx(\"img\", {\n    parentName: \"h2\",\n    \"src\": \"https://img.shields.io/badge/-%E2%89%A5%200.3-lightgrey\",\n    \"alt\": null\n  })), mdx(\"p\", null, \"Whilst templates do not include any data from your visual, they are intended to be portable. You would need to supply your own dataset but it should be possible to use this as jumping-off point elsewhere, similar to how you might start with an existing example before refining it in Deneb.\"), mdx(\"p\", null, \"As such, a template is either a Vega or Vega-Lite specification, with a custom \", mdx(\"inlineCode\", {\n    parentName: \"p\"\n  }, \"usermeta\"), \" object (\", mdx(OutboundLink, {\n    href: \"https://vega.github.io/vega/docs/specification/#top-level-specification-properties\",\n    target: \"_blank\",\n    mdxType: \"OutboundLink\"\n  }, \"Vega\"), \" | \", mdx(OutboundLink, {\n    href: \"https://vega.github.io/vega-lite/docs/spec.html#top-level\",\n    target: \"_blank\",\n    mdxType: \"OutboundLink\"\n  }, \"Vega-Lite\"), \"). This would typically be ignored by an external Vega parser but is used to identify the template as valid for Deneb. This has the following objects:\"), mdx(\"h3\", {\n    \"id\": \"deneb\",\n    \"style\": {\n      \"position\": \"relative\"\n    }\n  }, mdx(\"a\", {\n    parentName: \"h3\",\n    \"href\": \"#deneb\",\n    \"aria-label\": \"deneb permalink\",\n    \"className\": \"anchor before\"\n  }, mdx(\"svg\", {\n    parentName: \"a\",\n    \"aria-hidden\": \"true\",\n    \"focusable\": \"false\",\n    \"height\": \"16\",\n    \"version\": \"1.1\",\n    \"viewBox\": \"0 0 16 16\",\n    \"width\": \"16\"\n  }, mdx(\"path\", {\n    parentName: \"svg\",\n    \"fillRule\": \"evenodd\",\n    \"d\": \"M4 9h1v1H4c-1.5 0-3-1.69-3-3.5S2.55 3 4 3h4c1.45 0 3 1.69 3 3.5 0 1.41-.91 2.72-2 3.25V8.59c.58-.45 1-1.27 1-2.09C10 5.22 8.98 4 8 4H4c-.98 0-2 1.22-2 2.5S3 9 4 9zm9-3h-1v1h1c1 0 2 1.22 2 2.5S13.98 12 13 12H9c-.98 0-2-1.22-2-2.5 0-.83.42-1.64 1-2.09V6.25c-1.09.53-2 1.84-2 3.25C6 11.31 7.55 13 9 13h4c1.45 0 3-1.69 3-3.5S14.5 6 13 6z\"\n  }))), mdx(\"inlineCode\", {\n    parentName: \"h3\"\n  }, \"deneb\")), mdx(\"p\", null, mdx(\"em\", {\n    parentName: \"p\"\n  }, \"All properties are required.\")), mdx(\"ul\", null, mdx(\"li\", {\n    parentName: \"ul\"\n  }, mdx(\"inlineCode\", {\n    parentName: \"li\"\n  }, \"build\"), \": Which version the template was built with.\", mdx(\"ul\", {\n    parentName: \"li\"\n  }, mdx(\"li\", {\n    parentName: \"ul\"\n  }, \"Whist this is required, it is purely for the purposes of troubleshooting at these early stages, so is ideally left as-is.\"))), mdx(\"li\", {\n    parentName: \"ul\"\n  }, mdx(\"inlineCode\", {\n    parentName: \"li\"\n  }, \"metaVersion\"), \": The template metadata version.\", mdx(\"ul\", {\n    parentName: \"li\"\n  }, mdx(\"li\", {\n    parentName: \"ul\"\n  }, \"Only a value of \", mdx(\"inlineCode\", {\n    parentName: \"li\"\n  }, \"1\"), \" is currently supported.\"))), mdx(\"li\", {\n    parentName: \"ul\"\n  }, mdx(\"inlineCode\", {\n    parentName: \"li\"\n  }, \"provider\"), \": Which provider should be used when loading and parsing the template.\", mdx(\"ul\", {\n    parentName: \"li\"\n  }, mdx(\"li\", {\n    parentName: \"ul\"\n  }, \"Valid values are \", mdx(\"inlineCode\", {\n    parentName: \"li\"\n  }, \"vega\"), \" or \", mdx(\"inlineCode\", {\n    parentName: \"li\"\n  }, \"vegaLite\"), \".\"), mdx(\"li\", {\n    parentName: \"ul\"\n  }, \"If this is manually modified, Deneb will do its best to auto-resolve this from the top-level \", mdx(\"inlineCode\", {\n    parentName: \"li\"\n  }, \"$schema\"), \" property (if supplied), falling-back to parsing spec. It's not guaranteed to be successful.\")))), mdx(\"h3\", {\n    \"id\": \"information\",\n    \"style\": {\n      \"position\": \"relative\"\n    }\n  }, mdx(\"a\", {\n    parentName: \"h3\",\n    \"href\": \"#information\",\n    \"aria-label\": \"information permalink\",\n    \"className\": \"anchor before\"\n  }, mdx(\"svg\", {\n    parentName: \"a\",\n    \"aria-hidden\": \"true\",\n    \"focusable\": \"false\",\n    \"height\": \"16\",\n    \"version\": \"1.1\",\n    \"viewBox\": \"0 0 16 16\",\n    \"width\": \"16\"\n  }, mdx(\"path\", {\n    parentName: \"svg\",\n    \"fillRule\": \"evenodd\",\n    \"d\": \"M4 9h1v1H4c-1.5 0-3-1.69-3-3.5S2.55 3 4 3h4c1.45 0 3 1.69 3 3.5 0 1.41-.91 2.72-2 3.25V8.59c.58-.45 1-1.27 1-2.09C10 5.22 8.98 4 8 4H4c-.98 0-2 1.22-2 2.5S3 9 4 9zm9-3h-1v1h1c1 0 2 1.22 2 2.5S13.98 12 13 12H9c-.98 0-2-1.22-2-2.5 0-.83.42-1.64 1-2.09V6.25c-1.09.53-2 1.84-2 3.25C6 11.31 7.55 13 9 13h4c1.45 0 3-1.69 3-3.5S14.5 6 13 6z\"\n  }))), mdx(\"inlineCode\", {\n    parentName: \"h3\"\n  }, \"information\")), mdx(\"p\", null, \"The following required properties are populated from the details entered by the author in the \", mdx(\"em\", {\n    parentName: \"p\"\n  }, \"Template Information\"), \" pane from the \", mdx(\"em\", {\n    parentName: \"p\"\n  }, \"Create JSON Template\"), \" dialog:\"), mdx(\"ul\", null, mdx(\"li\", {\n    parentName: \"ul\"\n  }, mdx(\"inlineCode\", {\n    parentName: \"li\"\n  }, \"name\"), \": The name of the template that is displayed in the dialog for users, once imported.\"), mdx(\"li\", {\n    parentName: \"ul\"\n  }, mdx(\"inlineCode\", {\n    parentName: \"li\"\n  }, \"description\"), \": Longer-form details of the template purpose that are displayed in the dialog for users, once imported.\"), mdx(\"li\", {\n    parentName: \"ul\"\n  }, mdx(\"inlineCode\", {\n    parentName: \"li\"\n  }, \"author\"), \": Used to identify the author.\", mdx(\"ul\", {\n    parentName: \"li\"\n  }, mdx(\"li\", {\n    parentName: \"ul\"\n  }, \"Currently not displayed in the dialog upon import (but might be later on).\")))), mdx(\"p\", null, \"The following required properties are auto-generated by Deneb:\"), mdx(\"ul\", null, mdx(\"li\", {\n    parentName: \"ul\"\n  }, mdx(\"inlineCode\", {\n    parentName: \"li\"\n  }, \"uuid\"), \": unique ID for the template.\"), mdx(\"li\", {\n    parentName: \"ul\"\n  }, mdx(\"inlineCode\", {\n    parentName: \"li\"\n  }, \"generated\"), \": time (in UTC) the template was generated.\")), mdx(\"p\", null, \"The following properties are reserved for potential use elsewhere, and are not currently used within Deneb. This may change later on:\"), mdx(\"ul\", null, mdx(\"li\", {\n    parentName: \"ul\"\n  }, mdx(\"inlineCode\", {\n    parentName: \"li\"\n  }, \"supportUri\"), \": A URI to indicate where further information about the template can be found (such as a blog or website).\"), mdx(\"li\", {\n    parentName: \"ul\"\n  }, mdx(\"inlineCode\", {\n    parentName: \"li\"\n  }, \"videoUri\"), \": A URI to indicate where a supporting video asset, such as a demo or 'how-to' guide can be found.\"), mdx(\"li\", {\n    parentName: \"ul\"\n  }, mdx(\"inlineCode\", {\n    parentName: \"li\"\n  }, \"previewImageBase64PNG\"), \": Placeholder for a base64-encoded PNG image, which could be used for displaying a thumbnail or assistive image.\")), mdx(\"p\", null, \"The \", mdx(\"inlineCode\", {\n    parentName: \"p\"\n  }, \"information\"), \" object can be further extended with any properties you want for your own needs, but they will be ignored by Deneb upon import.\"), mdx(\"h3\", {\n    \"id\": \"dataset\",\n    \"style\": {\n      \"position\": \"relative\"\n    }\n  }, mdx(\"a\", {\n    parentName: \"h3\",\n    \"href\": \"#dataset\",\n    \"aria-label\": \"dataset permalink\",\n    \"className\": \"anchor before\"\n  }, mdx(\"svg\", {\n    parentName: \"a\",\n    \"aria-hidden\": \"true\",\n    \"focusable\": \"false\",\n    \"height\": \"16\",\n    \"version\": \"1.1\",\n    \"viewBox\": \"0 0 16 16\",\n    \"width\": \"16\"\n  }, mdx(\"path\", {\n    parentName: \"svg\",\n    \"fillRule\": \"evenodd\",\n    \"d\": \"M4 9h1v1H4c-1.5 0-3-1.69-3-3.5S2.55 3 4 3h4c1.45 0 3 1.69 3 3.5 0 1.41-.91 2.72-2 3.25V8.59c.58-.45 1-1.27 1-2.09C10 5.22 8.98 4 8 4H4c-.98 0-2 1.22-2 2.5S3 9 4 9zm9-3h-1v1h1c1 0 2 1.22 2 2.5S13.98 12 13 12H9c-.98 0-2-1.22-2-2.5 0-.83.42-1.64 1-2.09V6.25c-1.09.53-2 1.84-2 3.25C6 11.31 7.55 13 9 13h4c1.45 0 3-1.69 3-3.5S14.5 6 13 6z\"\n  }))), mdx(\"inlineCode\", {\n    parentName: \"h3\"\n  }, \"dataset\")), mdx(\"p\", null, mdx(\"em\", {\n    parentName: \"p\"\n  }, \"All properties are required.\")), mdx(\"h2\", {\n    \"id\": \"additional-considerations-for-developers\",\n    \"style\": {\n      \"position\": \"relative\"\n    }\n  }, mdx(\"a\", {\n    parentName: \"h2\",\n    \"href\": \"#additional-considerations-for-developers\",\n    \"aria-label\": \"additional considerations for developers permalink\",\n    \"className\": \"anchor before\"\n  }, mdx(\"svg\", {\n    parentName: \"a\",\n    \"aria-hidden\": \"true\",\n    \"focusable\": \"false\",\n    \"height\": \"16\",\n    \"version\": \"1.1\",\n    \"viewBox\": \"0 0 16 16\",\n    \"width\": \"16\"\n  }, mdx(\"path\", {\n    parentName: \"svg\",\n    \"fillRule\": \"evenodd\",\n    \"d\": \"M4 9h1v1H4c-1.5 0-3-1.69-3-3.5S2.55 3 4 3h4c1.45 0 3 1.69 3 3.5 0 1.41-.91 2.72-2 3.25V8.59c.58-.45 1-1.27 1-2.09C10 5.22 8.98 4 8 4H4c-.98 0-2 1.22-2 2.5S3 9 4 9zm9-3h-1v1h1c1 0 2 1.22 2 2.5S13.98 12 13 12H9c-.98 0-2-1.22-2-2.5 0-.83.42-1.64 1-2.09V6.25c-1.09.53-2 1.84-2 3.25C6 11.31 7.55 13 9 13h4c1.45 0 3-1.69 3-3.5S14.5 6 13 6z\"\n  }))), \"Additional Considerations for Developers\"), mdx(\"p\", null, \"If you're looking to generate suitable templates offline that can be imported, then you'll need to ensure that the Vega or Vega-Lite component (i.e. the main spec) validates accordingly.\"), mdx(\"p\", null, \"As the \", mdx(\"inlineCode\", {\n    parentName: \"p\"\n  }, \"usermeta\"), \" object is extensible, there is a JSON schema you can use to validate that your object will parse correctly in Deneb when imported. This is hosted at:\"), mdx(\"p\", null, mdx(\"a\", {\n    parentName: \"p\",\n    \"href\": \"https://deneb-viz.github.io/schema/deneb-template-usermeta-v1.json\"\n  }, \"https://deneb-viz.github.io/schema/deneb-template-usermeta-v1.json\")));\n}\n;\nMDXContent.isMDXComponent = true;","headings":[{"depth":2,"value":"Importing a Template "},{"depth":3,"value":"Dataset Placeholders"},{"depth":3,"value":"Populating Placeholders"},{"depth":2,"value":"Generating a Template "},{"depth":3,"value":"Template Information"},{"depth":3,"value":"Template Information"},{"depth":3,"value":"Review and Copy to Clipboard"},{"depth":3,"value":"Saving the Template File"},{"depth":2,"value":"Template Structure "},{"depth":3,"value":"deneb"},{"depth":3,"value":"information"},{"depth":3,"value":"dataset"},{"depth":2,"value":"Additional Considerations for Developers"}]}},"pageContext":{"slug":"/templates/","prev":{"label":"Pattern Fills","link":"/pattern-fills"},"next":{"label":"Performance Considerations","link":"/performance-considerations"},"repositoryEditUrl":"https://github.com/deneb-viz/deneb-viz.github.io/tree/source/src/docs/templates.mdx","repositoryProvider":"GitHub"}},
    "staticQueryHashes": ["1954253342","2328931024","2501019404","973074209"]}