{
    "componentChunkName": "component---node-modules-rocketseat-gatsby-theme-docs-core-src-templates-docs-query-js",
    "path": "/changelog",
    "result": {"data":{"mdx":{"id":"6c837e51-a0a1-5c2a-bb4b-ef1a554bab36","excerpt":"1.0.0 (2021-11-13) IMPORTANT NOTES This is the promotion of the public preview codebase into  the official AppSource release  ðŸŽ‰ðŸŽ‰ðŸŽ‰ðŸŽ‰ Fetching via remote URLsâ€¦","fields":{"slug":"/changelog/"},"frontmatter":{"title":"Change Log","description":"Deneb custom visual Change Log","image":"/images/favicon.png","disableTableOfContents":false},"body":"var _excluded = [\"components\"];\n\nfunction _extends() { _extends = Object.assign || function (target) { for (var i = 1; i < arguments.length; i++) { var source = arguments[i]; for (var key in source) { if (Object.prototype.hasOwnProperty.call(source, key)) { target[key] = source[key]; } } } return target; }; return _extends.apply(this, arguments); }\n\nfunction _objectWithoutProperties(source, excluded) { if (source == null) return {}; var target = _objectWithoutPropertiesLoose(source, excluded); var key, i; if (Object.getOwnPropertySymbols) { var sourceSymbolKeys = Object.getOwnPropertySymbols(source); for (i = 0; i < sourceSymbolKeys.length; i++) { key = sourceSymbolKeys[i]; if (excluded.indexOf(key) >= 0) continue; if (!Object.prototype.propertyIsEnumerable.call(source, key)) continue; target[key] = source[key]; } } return target; }\n\nfunction _objectWithoutPropertiesLoose(source, excluded) { if (source == null) return {}; var target = {}; var sourceKeys = Object.keys(source); var key, i; for (i = 0; i < sourceKeys.length; i++) { key = sourceKeys[i]; if (excluded.indexOf(key) >= 0) continue; target[key] = source[key]; } return target; }\n\n/* @jsxRuntime classic */\n\n/* @jsx mdx */\nvar _frontmatter = {\n  \"title\": \"Change Log\",\n  \"description\": \"Deneb custom visual Change Log\",\n  \"image\": \"/images/favicon.png\",\n  \"disableTableOfContents\": false\n};\nvar layoutProps = {\n  _frontmatter: _frontmatter\n};\nvar MDXLayout = \"wrapper\";\nreturn function MDXContent(_ref) {\n  var components = _ref.components,\n      props = _objectWithoutProperties(_ref, _excluded);\n\n  return mdx(MDXLayout, _extends({}, layoutProps, props, {\n    components: components,\n    mdxType: \"MDXLayout\"\n  }), mdx(\"h2\", {\n    \"id\": \"100-2021-11-13\",\n    \"style\": {\n      \"position\": \"relative\"\n    }\n  }, mdx(\"a\", {\n    parentName: \"h2\",\n    \"href\": \"#100-2021-11-13\",\n    \"aria-label\": \"100 2021 11 13 permalink\",\n    \"className\": \"anchor before\"\n  }, mdx(\"svg\", {\n    parentName: \"a\",\n    \"aria-hidden\": \"true\",\n    \"focusable\": \"false\",\n    \"height\": \"16\",\n    \"version\": \"1.1\",\n    \"viewBox\": \"0 0 16 16\",\n    \"width\": \"16\"\n  }, mdx(\"path\", {\n    parentName: \"svg\",\n    \"fillRule\": \"evenodd\",\n    \"d\": \"M4 9h1v1H4c-1.5 0-3-1.69-3-3.5S2.55 3 4 3h4c1.45 0 3 1.69 3 3.5 0 1.41-.91 2.72-2 3.25V8.59c.58-.45 1-1.27 1-2.09C10 5.22 8.98 4 8 4H4c-.98 0-2 1.22-2 2.5S3 9 4 9zm9-3h-1v1h1c1 0 2 1.22 2 2.5S13.98 12 13 12H9c-.98 0-2-1.22-2-2.5 0-.83.42-1.64 1-2.09V6.25c-1.09.53-2 1.84-2 3.25C6 11.31 7.55 13 9 13h4c1.45 0 3-1.69 3-3.5S14.5 6 13 6z\"\n  }))), \"1.0.0 (2021-11-13)\"), mdx(\"h4\", {\n    \"id\": \"important-notes\",\n    \"style\": {\n      \"position\": \"relative\"\n    }\n  }, mdx(\"a\", {\n    parentName: \"h4\",\n    \"href\": \"#important-notes\",\n    \"aria-label\": \"important notes permalink\",\n    \"className\": \"anchor before\"\n  }, mdx(\"svg\", {\n    parentName: \"a\",\n    \"aria-hidden\": \"true\",\n    \"focusable\": \"false\",\n    \"height\": \"16\",\n    \"version\": \"1.1\",\n    \"viewBox\": \"0 0 16 16\",\n    \"width\": \"16\"\n  }, mdx(\"path\", {\n    parentName: \"svg\",\n    \"fillRule\": \"evenodd\",\n    \"d\": \"M4 9h1v1H4c-1.5 0-3-1.69-3-3.5S2.55 3 4 3h4c1.45 0 3 1.69 3 3.5 0 1.41-.91 2.72-2 3.25V8.59c.58-.45 1-1.27 1-2.09C10 5.22 8.98 4 8 4H4c-.98 0-2 1.22-2 2.5S3 9 4 9zm9-3h-1v1h1c1 0 2 1.22 2 2.5S13.98 12 13 12H9c-.98 0-2-1.22-2-2.5 0-.83.42-1.64 1-2.09V6.25c-1.09.53-2 1.84-2 3.25C6 11.31 7.55 13 9 13h4c1.45 0 3-1.69 3-3.5S14.5 6 13 6z\"\n  }))), \"IMPORTANT NOTES\"), mdx(\"ul\", null, mdx(\"li\", {\n    parentName: \"ul\"\n  }, \"This is the promotion of the public preview codebase into \", mdx(OutboundLink, {\n    href: \"https://appsource.microsoft.com/en-us/product/power-bi-visuals/coacervolimited1596856650797.deneb\",\n    target: \"_blank\",\n    mdxType: \"OutboundLink\"\n  }, \"the official AppSource release\"), \" \\uD83C\\uDF89\\uD83C\\uDF89\\uD83C\\uDF89\\uD83C\\uDF89\"), mdx(\"li\", {\n    parentName: \"ul\"\n  }, \"Fetching via remote URLs (e.g. for image marks) has been disabled to comply with Power BI certification requirements. This can be mitigated by \", mdx(\"a\", {\n    parentName: \"li\",\n    \"href\": \"/installation\"\n  }, \"downloading the standalone version\"), \".\"), mdx(\"li\", {\n    parentName: \"ul\"\n  }, \"There a no major changes in this release; just those that help with QA.\")), mdx(\"h4\", {\n    \"id\": \"bugs-fixed\",\n    \"style\": {\n      \"position\": \"relative\"\n    }\n  }, mdx(\"a\", {\n    parentName: \"h4\",\n    \"href\": \"#bugs-fixed\",\n    \"aria-label\": \"bugs fixed permalink\",\n    \"className\": \"anchor before\"\n  }, mdx(\"svg\", {\n    parentName: \"a\",\n    \"aria-hidden\": \"true\",\n    \"focusable\": \"false\",\n    \"height\": \"16\",\n    \"version\": \"1.1\",\n    \"viewBox\": \"0 0 16 16\",\n    \"width\": \"16\"\n  }, mdx(\"path\", {\n    parentName: \"svg\",\n    \"fillRule\": \"evenodd\",\n    \"d\": \"M4 9h1v1H4c-1.5 0-3-1.69-3-3.5S2.55 3 4 3h4c1.45 0 3 1.69 3 3.5 0 1.41-.91 2.72-2 3.25V8.59c.58-.45 1-1.27 1-2.09C10 5.22 8.98 4 8 4H4c-.98 0-2 1.22-2 2.5S3 9 4 9zm9-3h-1v1h1c1 0 2 1.22 2 2.5S13.98 12 13 12H9c-.98 0-2-1.22-2-2.5 0-.83.42-1.64 1-2.09V6.25c-1.09.53-2 1.84-2 3.25C6 11.31 7.55 13 9 13h4c1.45 0 3-1.69 3-3.5S14.5 6 13 6z\"\n  }))), \"Bugs Fixed\"), mdx(\"ul\", null, mdx(\"li\", {\n    parentName: \"ul\"\n  }, \"Swapping editor position causes editor UI to crash (#137)\")), mdx(\"h4\", {\n    \"id\": \"performance-and-stability\",\n    \"style\": {\n      \"position\": \"relative\"\n    }\n  }, mdx(\"a\", {\n    parentName: \"h4\",\n    \"href\": \"#performance-and-stability\",\n    \"aria-label\": \"performance and stability permalink\",\n    \"className\": \"anchor before\"\n  }, mdx(\"svg\", {\n    parentName: \"a\",\n    \"aria-hidden\": \"true\",\n    \"focusable\": \"false\",\n    \"height\": \"16\",\n    \"version\": \"1.1\",\n    \"viewBox\": \"0 0 16 16\",\n    \"width\": \"16\"\n  }, mdx(\"path\", {\n    parentName: \"svg\",\n    \"fillRule\": \"evenodd\",\n    \"d\": \"M4 9h1v1H4c-1.5 0-3-1.69-3-3.5S2.55 3 4 3h4c1.45 0 3 1.69 3 3.5 0 1.41-.91 2.72-2 3.25V8.59c.58-.45 1-1.27 1-2.09C10 5.22 8.98 4 8 4H4c-.98 0-2 1.22-2 2.5S3 9 4 9zm9-3h-1v1h1c1 0 2 1.22 2 2.5S13.98 12 13 12H9c-.98 0-2-1.22-2-2.5 0-.83.42-1.64 1-2.09V6.25c-1.09.53-2 1.84-2 3.25C6 11.31 7.55 13 9 13h4c1.45 0 3-1.69 3-3.5S14.5 6 13 6z\"\n  }))), \"Performance and Stability\"), mdx(\"ul\", null, mdx(\"li\", {\n    parentName: \"ul\"\n  }, \"Improved target area of whitespace for clearing an active selection (#140)\"), mdx(\"li\", {\n    parentName: \"ul\"\n  }, \"Visual rendering events synced-up with Vega View API (#141)\")), mdx(\"h2\", {\n    \"id\": \"060-2021-10-11\",\n    \"style\": {\n      \"position\": \"relative\"\n    }\n  }, mdx(\"a\", {\n    parentName: \"h2\",\n    \"href\": \"#060-2021-10-11\",\n    \"aria-label\": \"060 2021 10 11 permalink\",\n    \"className\": \"anchor before\"\n  }, mdx(\"svg\", {\n    parentName: \"a\",\n    \"aria-hidden\": \"true\",\n    \"focusable\": \"false\",\n    \"height\": \"16\",\n    \"version\": \"1.1\",\n    \"viewBox\": \"0 0 16 16\",\n    \"width\": \"16\"\n  }, mdx(\"path\", {\n    parentName: \"svg\",\n    \"fillRule\": \"evenodd\",\n    \"d\": \"M4 9h1v1H4c-1.5 0-3-1.69-3-3.5S2.55 3 4 3h4c1.45 0 3 1.69 3 3.5 0 1.41-.91 2.72-2 3.25V8.59c.58-.45 1-1.27 1-2.09C10 5.22 8.98 4 8 4H4c-.98 0-2 1.22-2 2.5S3 9 4 9zm9-3h-1v1h1c1 0 2 1.22 2 2.5S13.98 12 13 12H9c-.98 0-2-1.22-2-2.5 0-.83.42-1.64 1-2.09V6.25c-1.09.53-2 1.84-2 3.25C6 11.31 7.55 13 9 13h4c1.45 0 3-1.69 3-3.5S14.5 6 13 6z\"\n  }))), \"0.6.0 (2021-10-11)\"), mdx(\"h4\", {\n    \"id\": \"important-notes-1\",\n    \"style\": {\n      \"position\": \"relative\"\n    }\n  }, mdx(\"a\", {\n    parentName: \"h4\",\n    \"href\": \"#important-notes-1\",\n    \"aria-label\": \"important notes 1 permalink\",\n    \"className\": \"anchor before\"\n  }, mdx(\"svg\", {\n    parentName: \"a\",\n    \"aria-hidden\": \"true\",\n    \"focusable\": \"false\",\n    \"height\": \"16\",\n    \"version\": \"1.1\",\n    \"viewBox\": \"0 0 16 16\",\n    \"width\": \"16\"\n  }, mdx(\"path\", {\n    parentName: \"svg\",\n    \"fillRule\": \"evenodd\",\n    \"d\": \"M4 9h1v1H4c-1.5 0-3-1.69-3-3.5S2.55 3 4 3h4c1.45 0 3 1.69 3 3.5 0 1.41-.91 2.72-2 3.25V8.59c.58-.45 1-1.27 1-2.09C10 5.22 8.98 4 8 4H4c-.98 0-2 1.22-2 2.5S3 9 4 9zm9-3h-1v1h1c1 0 2 1.22 2 2.5S13.98 12 13 12H9c-.98 0-2-1.22-2-2.5 0-.83.42-1.64 1-2.09V6.25c-1.09.53-2 1.84-2 3.25C6 11.31 7.55 13 9 13h4c1.45 0 3-1.69 3-3.5S14.5 6 13 6z\"\n  }))), \"IMPORTANT NOTES\"), mdx(\"ul\", null, mdx(\"li\", {\n    parentName: \"ul\"\n  }, \"In preparation for AppSource submission (hopefully soon) and to leverage modern tooltips, the Power BI visual APIs have been updated to the latest versions. As such, if you're using Power BI Report Server, you will need to be running \", mdx(OutboundLink, {\n    href: \"https://powerbi.microsoft.com/en-us/blog/power-bi-report-server-september-2021-feature-summary/\",\n    target: \"_blank\",\n    mdxType: \"OutboundLink\"\n  }, \"September 2021\"), \") or later.\"), mdx(\"li\", {\n    parentName: \"ul\"\n  }, \"If you are currently using external URLs in your specifications, these will not be permitted upon submission to AppSource due to certification requirements.\", mdx(\"ul\", {\n    parentName: \"li\"\n  }, mdx(\"li\", {\n    parentName: \"ul\"\n  }, \"This feature is still enabled in 0.6 but may be switched off in future.\"), mdx(\"li\", {\n    parentName: \"ul\"\n  }, \"If and when this happens, we will make a separate version available with the feature enabled.\")))), mdx(\"h4\", {\n    \"id\": \"new-features-and-enhancements\",\n    \"style\": {\n      \"position\": \"relative\"\n    }\n  }, mdx(\"a\", {\n    parentName: \"h4\",\n    \"href\": \"#new-features-and-enhancements\",\n    \"aria-label\": \"new features and enhancements permalink\",\n    \"className\": \"anchor before\"\n  }, mdx(\"svg\", {\n    parentName: \"a\",\n    \"aria-hidden\": \"true\",\n    \"focusable\": \"false\",\n    \"height\": \"16\",\n    \"version\": \"1.1\",\n    \"viewBox\": \"0 0 16 16\",\n    \"width\": \"16\"\n  }, mdx(\"path\", {\n    parentName: \"svg\",\n    \"fillRule\": \"evenodd\",\n    \"d\": \"M4 9h1v1H4c-1.5 0-3-1.69-3-3.5S2.55 3 4 3h4c1.45 0 3 1.69 3 3.5 0 1.41-.91 2.72-2 3.25V8.59c.58-.45 1-1.27 1-2.09C10 5.22 8.98 4 8 4H4c-.98 0-2 1.22-2 2.5S3 9 4 9zm9-3h-1v1h1c1 0 2 1.22 2 2.5S13.98 12 13 12H9c-.98 0-2-1.22-2-2.5 0-.83.42-1.64 1-2.09V6.25c-1.09.53-2 1.84-2 3.25C6 11.31 7.55 13 9 13h4c1.45 0 3-1.69 3-3.5S14.5 6 13 6z\"\n  }))), \"New Features and Enhancements\"), mdx(\"ul\", null, mdx(\"li\", {\n    parentName: \"ul\"\n  }, mdx(\"p\", {\n    parentName: \"li\"\n  }, mdx(\"a\", {\n    parentName: \"p\",\n    \"href\": \"/interactivity-context-menu\"\n  }, \"Context Menu\"), \" (#5) and \", mdx(\"a\", {\n    parentName: \"p\",\n    \"href\": \"/interactivity-selection\"\n  }, \"Cross-Filtering\"), \" support (#6) have been added.\"), mdx(\"ul\", {\n    parentName: \"li\"\n  }, mdx(\"li\", {\n    parentName: \"ul\"\n  }, \"Due to the flexible nature of Vega/Vega-Lite, and how data point reconciliation works across visuals and to the data model within Power BI, there are some things to take into consideration.\"), mdx(\"li\", {\n    parentName: \"ul\"\n  }, \"Please refer to the appropriate Interactivity Features pages for more specific information.\"))), mdx(\"li\", {\n    parentName: \"ul\"\n  }, mdx(OutboundLink, {\n    href: \"https://docs.microsoft.com/en-us/power-bi/create-reports/desktop-visual-tooltips\",\n    target: \"_blank\",\n    mdxType: \"OutboundLink\"\n  }, \"Modern tooltip support\"), \" has been added. These will display instead of conventional tooltips, if you have them enabled in your report. (#121)\"), mdx(\"li\", {\n    parentName: \"ul\"\n  }, mdx(\"p\", {\n    parentName: \"li\"\n  }, \"Loader feature is now correctly disabled, which is intended to ensure that external URLs cannot be accessed for certification purposes. Please refer to \", mdx(\"strong\", {\n    parentName: \"p\"\n  }, \"important notes\"), \" section above regarding this feature. (#114)\")), mdx(\"li\", {\n    parentName: \"ul\"\n  }, mdx(\"p\", {\n    parentName: \"li\"\n  }, \"Tooltip \", mdx(\"a\", {\n    parentName: \"p\",\n    \"href\": \"/interactivity-tooltips#debugging-with-tooltips\"\n  }, \"'redaction' of interactivity reserved words\"), \" (introduced in 0.5/#80) are now recursively applied to deeper-nested objects. (#118)\"))), mdx(\"h4\", {\n    \"id\": \"bugs-fixed-1\",\n    \"style\": {\n      \"position\": \"relative\"\n    }\n  }, mdx(\"a\", {\n    parentName: \"h4\",\n    \"href\": \"#bugs-fixed-1\",\n    \"aria-label\": \"bugs fixed 1 permalink\",\n    \"className\": \"anchor before\"\n  }, mdx(\"svg\", {\n    parentName: \"a\",\n    \"aria-hidden\": \"true\",\n    \"focusable\": \"false\",\n    \"height\": \"16\",\n    \"version\": \"1.1\",\n    \"viewBox\": \"0 0 16 16\",\n    \"width\": \"16\"\n  }, mdx(\"path\", {\n    parentName: \"svg\",\n    \"fillRule\": \"evenodd\",\n    \"d\": \"M4 9h1v1H4c-1.5 0-3-1.69-3-3.5S2.55 3 4 3h4c1.45 0 3 1.69 3 3.5 0 1.41-.91 2.72-2 3.25V8.59c.58-.45 1-1.27 1-2.09C10 5.22 8.98 4 8 4H4c-.98 0-2 1.22-2 2.5S3 9 4 9zm9-3h-1v1h1c1 0 2 1.22 2 2.5S13.98 12 13 12H9c-.98 0-2-1.22-2-2.5 0-.83.42-1.64 1-2.09V6.25c-1.09.53-2 1.84-2 3.25C6 11.31 7.55 13 9 13h4c1.45 0 3-1.69 3-3.5S14.5 6 13 6z\"\n  }))), \"Bugs Fixed\"), mdx(\"ul\", null, mdx(\"li\", {\n    parentName: \"ul\"\n  }, \"If the dataset contained a date/time column with a \", mdx(\"inlineCode\", {\n    parentName: \"li\"\n  }, \"null\"), \"/\", mdx(\"inlineCode\", {\n    parentName: \"li\"\n  }, \"(blank)\"), \" value, this would cause data mapping to fail and result in an empty dataset (#126)\"), mdx(\"li\", {\n    parentName: \"ul\"\n  }, \"If the height of the settings pane exceeded the visible window, it would not scroll properly (#122)\"), mdx(\"li\", {\n    parentName: \"ul\"\n  }, \"If using the canvas renderer, quickly mousing-out of the visual would leave tooltips visible if they were in the process of being displayed (#16)\"), mdx(\"li\", {\n    parentName: \"ul\"\n  }, \"When a template is selected in the \", mdx(\"em\", {\n    parentName: \"li\"\n  }, \"Create New Specification\"), \" dialog, and provider is changed, the selected template is reset but the highlight in the list is incorrect (#3)\")), mdx(\"h4\", {\n    \"id\": \"performance-and-stability-1\",\n    \"style\": {\n      \"position\": \"relative\"\n    }\n  }, mdx(\"a\", {\n    parentName: \"h4\",\n    \"href\": \"#performance-and-stability-1\",\n    \"aria-label\": \"performance and stability 1 permalink\",\n    \"className\": \"anchor before\"\n  }, mdx(\"svg\", {\n    parentName: \"a\",\n    \"aria-hidden\": \"true\",\n    \"focusable\": \"false\",\n    \"height\": \"16\",\n    \"version\": \"1.1\",\n    \"viewBox\": \"0 0 16 16\",\n    \"width\": \"16\"\n  }, mdx(\"path\", {\n    parentName: \"svg\",\n    \"fillRule\": \"evenodd\",\n    \"d\": \"M4 9h1v1H4c-1.5 0-3-1.69-3-3.5S2.55 3 4 3h4c1.45 0 3 1.69 3 3.5 0 1.41-.91 2.72-2 3.25V8.59c.58-.45 1-1.27 1-2.09C10 5.22 8.98 4 8 4H4c-.98 0-2 1.22-2 2.5S3 9 4 9zm9-3h-1v1h1c1 0 2 1.22 2 2.5S13.98 12 13 12H9c-.98 0-2-1.22-2-2.5 0-.83.42-1.64 1-2.09V6.25c-1.09.53-2 1.84-2 3.25C6 11.31 7.55 13 9 13h4c1.45 0 3-1.69 3-3.5S14.5 6 13 6z\"\n  }))), \"Performance and Stability\"), mdx(\"ul\", null, mdx(\"li\", {\n    parentName: \"ul\"\n  }, \"Vega builds have been updated:\", mdx(\"ul\", {\n    parentName: \"li\"\n  }, mdx(\"li\", {\n    parentName: \"ul\"\n  }, \"Vega \", mdx(\"strong\", {\n    parentName: \"li\"\n  }, \"5.21.0\")), mdx(\"li\", {\n    parentName: \"ul\"\n  }, \"Vega-Lite \", mdx(\"strong\", {\n    parentName: \"li\"\n  }, \"5.1.1\")))), mdx(\"li\", {\n    parentName: \"ul\"\n  }, \"Import issue w/lodash and initial CI for contributed code - many thanks to \", mdx(OutboundLink, {\n    href: \"https://github.com/sgratzl\",\n    target: \"_blank\",\n    mdxType: \"OutboundLink\"\n  }, \"@sgratzl\"), \"! (#132 & #133)\")), mdx(\"h2\", {\n    \"id\": \"050-2021-08-30\",\n    \"style\": {\n      \"position\": \"relative\"\n    }\n  }, mdx(\"a\", {\n    parentName: \"h2\",\n    \"href\": \"#050-2021-08-30\",\n    \"aria-label\": \"050 2021 08 30 permalink\",\n    \"className\": \"anchor before\"\n  }, mdx(\"svg\", {\n    parentName: \"a\",\n    \"aria-hidden\": \"true\",\n    \"focusable\": \"false\",\n    \"height\": \"16\",\n    \"version\": \"1.1\",\n    \"viewBox\": \"0 0 16 16\",\n    \"width\": \"16\"\n  }, mdx(\"path\", {\n    parentName: \"svg\",\n    \"fillRule\": \"evenodd\",\n    \"d\": \"M4 9h1v1H4c-1.5 0-3-1.69-3-3.5S2.55 3 4 3h4c1.45 0 3 1.69 3 3.5 0 1.41-.91 2.72-2 3.25V8.59c.58-.45 1-1.27 1-2.09C10 5.22 8.98 4 8 4H4c-.98 0-2 1.22-2 2.5S3 9 4 9zm9-3h-1v1h1c1 0 2 1.22 2 2.5S13.98 12 13 12H9c-.98 0-2-1.22-2-2.5 0-.83.42-1.64 1-2.09V6.25c-1.09.53-2 1.84-2 3.25C6 11.31 7.55 13 9 13h4c1.45 0 3-1.69 3-3.5S14.5 6 13 6z\"\n  }))), \"0.5.0 (2021-08-30)\"), mdx(\"h4\", {\n    \"id\": \"new-features-and-enhancements-1\",\n    \"style\": {\n      \"position\": \"relative\"\n    }\n  }, mdx(\"a\", {\n    parentName: \"h4\",\n    \"href\": \"#new-features-and-enhancements-1\",\n    \"aria-label\": \"new features and enhancements 1 permalink\",\n    \"className\": \"anchor before\"\n  }, mdx(\"svg\", {\n    parentName: \"a\",\n    \"aria-hidden\": \"true\",\n    \"focusable\": \"false\",\n    \"height\": \"16\",\n    \"version\": \"1.1\",\n    \"viewBox\": \"0 0 16 16\",\n    \"width\": \"16\"\n  }, mdx(\"path\", {\n    parentName: \"svg\",\n    \"fillRule\": \"evenodd\",\n    \"d\": \"M4 9h1v1H4c-1.5 0-3-1.69-3-3.5S2.55 3 4 3h4c1.45 0 3 1.69 3 3.5 0 1.41-.91 2.72-2 3.25V8.59c.58-.45 1-1.27 1-2.09C10 5.22 8.98 4 8 4H4c-.98 0-2 1.22-2 2.5S3 9 4 9zm9-3h-1v1h1c1 0 2 1.22 2 2.5S13.98 12 13 12H9c-.98 0-2-1.22-2-2.5 0-.83.42-1.64 1-2.09V6.25c-1.09.53-2 1.84-2 3.25C6 11.31 7.55 13 9 13h4c1.45 0 3-1.69 3-3.5S14.5 6 13 6z\"\n  }))), \"New Features and Enhancements\"), mdx(\"ul\", null, mdx(\"li\", {\n    parentName: \"ul\"\n  }, mdx(\"p\", {\n    parentName: \"li\"\n  }, \"Common pre-defined pattern fills for SVG renderer. \", mdx(\"strong\", {\n    parentName: \"p\"\n  }, \"This is Deneb-specific\"), \" and not native to Vega or Vega-Lite specifications, so please read the \", mdx(\"a\", {\n    parentName: \"p\",\n    \"href\": \"/pattern-fills\"\n  }, \"Pattern Fills\"), \" page for further details on how to get started. (#30).\")), mdx(\"li\", {\n    parentName: \"ul\"\n  }, mdx(\"p\", {\n    parentName: \"li\"\n  }, \"Visual viewport preservation and \\\"detail work\\\" enhancements (#15). This is covered in more detail in the \", mdx(\"a\", {\n    parentName: \"p\",\n    \"href\": \"/visual-editor\"\n  }, \"Visual Editor\"), \" page, but a short run-down is as follows:\"), mdx(\"ul\", {\n    parentName: \"li\"\n  }, mdx(\"li\", {\n    parentName: \"ul\"\n  }, mdx(\"p\", {\n    parentName: \"li\"\n  }, \"Deneb will now record the dimensions of your visual in the report canvas when the advanced editor is opened, and use these dimensions when presenting your visual preview, rather than stretching it to fit available space, e.g.:\"), mdx(\"p\", {\n    parentName: \"li\"\n  }, mdx(\"img\", {\n    parentName: \"p\",\n    \"src\": \"/images/changelog/0.5-previous-editor-viewport.png\",\n    \"alt\": \"0.5-previous-editor-viewport.png\",\n    \"title\": \"Showing differences between how the advanced editor represents your rendered visual. In versions prior to 0.5, the rendered visual is stretced to fit the available space (if a single or layered plot), whereas the dimensions of the visual in the report view are preserved for a better representation.\"\n  }))), mdx(\"li\", {\n    parentName: \"ul\"\n  }, mdx(\"p\", {\n    parentName: \"li\"\n  }, \"The intention of this is to keep the visual scaled as it will be viewed at its current dimensions.\")), mdx(\"li\", {\n    parentName: \"ul\"\n  }, mdx(\"p\", {\n    parentName: \"li\"\n  }, \"Note that \", mdx(\"strong\", {\n    parentName: \"p\"\n  }, \"Power BI does not allow visuals to resize themselves dynamically\"), \", so if you wish to change the physical width and/or height of your visual in the report view, you will need to exit the advanced editor, resize and re-open the advanced editor.\")), mdx(\"li\", {\n    parentName: \"ul\"\n  }, mdx(\"p\", {\n    parentName: \"li\"\n  }, \"Additionally, a toolbar is available at the bottom of the preview area, which will allow you to adjust the zoom level of the preview:\"), mdx(\"p\", {\n    parentName: \"li\"\n  }, mdx(\"img\", {\n    parentName: \"p\",\n    \"src\": \"/images/changelog/0.5-zoom-controls.png\",\n    \"alt\": \"0.5-zoom-controls.png\",\n    \"title\": \"The preview area toolbar contains additional controls for zooming in or out of your visual preview.\"\n  }))))), mdx(\"li\", {\n    parentName: \"ul\"\n  }, mdx(\"p\", {\n    parentName: \"li\"\n  }, \"The top-level \", mdx(\"inlineCode\", {\n    parentName: \"p\"\n  }, \"height\"), \" and \", mdx(\"inlineCode\", {\n    parentName: \"p\"\n  }, \"width\"), \" properties can now be applied if necessary, rather than Deneb attempting to resolve them to the visual container (#48).\"), mdx(\"ul\", {\n    parentName: \"li\"\n  }, mdx(\"li\", {\n    parentName: \"ul\"\n  }, \"This means that it is now possible to size single view or layered Vega-Lite specifications \", mdx(OutboundLink, {\n    href: \"https://vega.github.io/vega-lite/docs/size.html#specifying-width-and-height-per-discrete-step\",\n    target: \"_blank\",\n    mdxType: \"OutboundLink\"\n  }, \"by discrete step\"), \".\"), mdx(\"li\", {\n    parentName: \"ul\"\n  }, \"For Vega specifications, two additional signals - \", mdx(\"inlineCode\", {\n    parentName: \"li\"\n  }, \"pbiContainerHeight\"), \" and \", mdx(\"inlineCode\", {\n    parentName: \"li\"\n  }, \"pbiContainerWidth\"), \" - are available to use the desired container dimension. These are automatically patched into a Vega spec if the \", mdx(\"inlineCode\", {\n    parentName: \"li\"\n  }, \"height\"), \" and/or \", mdx(\"inlineCode\", {\n    parentName: \"li\"\n  }, \"width\"), \" properties are omitted.\"))), mdx(\"li\", {\n    parentName: \"ul\"\n  }, mdx(\"p\", {\n    parentName: \"li\"\n  }, \"New Specification and Export JSON Template dialogs now use more real-estate (#85).\")), mdx(\"li\", {\n    parentName: \"ul\"\n  }, mdx(\"p\", {\n    parentName: \"li\"\n  }, \"Rather than creating a new line for and occurrence of each collection/object, list/array or property, the \", mdx(\"a\", {\n    parentName: \"p\",\n    \"href\": \"/visual-editor#repair-and-format-json\"\n  }, \"Repair and Format JSON\"), \" command will now try to pretty-print JSON more effectively, i.e. only creating line breaks where sensible to do so. (#110)\")), mdx(\"li\", {\n    parentName: \"ul\"\n  }, mdx(\"p\", {\n    parentName: \"li\"\n  }, \"Objects in tooltips are now more readable (#80).\"), mdx(\"ul\", {\n    parentName: \"li\"\n  }, mdx(\"li\", {\n    parentName: \"ul\"\n  }, \"For example, if using techniques to expose the full tooltip datum, e.g. using \", mdx(\"inlineCode\", {\n    parentName: \"li\"\n  }, \"{ \\\"tooltip\\\" { \\\"content\\\": \\\"data\\\" } }\"), \" for Vega-Lite, the tooltip handler would expose any nested objects as \", mdx(\"inlineCode\", {\n    parentName: \"li\"\n  }, \"[object Object]\"), \".\"), mdx(\"li\", {\n    parentName: \"ul\"\n  }, \"These objects are now converted to a text representation of the object structure:\\n\", mdx(\"img\", {\n    parentName: \"li\",\n    \"src\": \"/images/changelog/0.5-previous-tooltip-object.png\",\n    \"alt\": \"0.5-previous-tooltip-object.png\",\n    \"title\": \"Showing differences between representation of objects in Power BI's default tooltip between version 0.4 and 0.5. In 0.4, the object is obscured, but in 0.5 this is seralised to JSON for easier reading.\"\n  })), mdx(\"li\", {\n    parentName: \"ul\"\n  }, \"Note that the presence of an \", mdx(\"inlineCode\", {\n    parentName: \"li\"\n  }, \"__identity__\"), \" and/or \", mdx(\"inlineCode\", {\n    parentName: \"li\"\n  }, \"__key__\"), \" and \", mdx(\"inlineCode\", {\n    parentName: \"li\"\n  }, \"identityIndex\"), \" properties means that the underlying data point can be reconciled back to Power BI and may help with confirming that a mark will resolve for \", mdx(\"a\", {\n    parentName: \"li\",\n    \"href\": \"/interactivity-features-overview/#signaling-back-to-power-bi\"\n  }, \"interactivity purposes\"), \".\"))), mdx(\"li\", {\n    parentName: \"ul\"\n  }, mdx(\"p\", {\n    parentName: \"li\"\n  }, \"The \", mdx(\"strong\", {\n    parentName: \"p\"\n  }, \"en-GB\"), \" locale has been added to the standard Vega (D3) formatter (#111).\"))), mdx(\"h4\", {\n    \"id\": \"bugs-fixed-2\",\n    \"style\": {\n      \"position\": \"relative\"\n    }\n  }, mdx(\"a\", {\n    parentName: \"h4\",\n    \"href\": \"#bugs-fixed-2\",\n    \"aria-label\": \"bugs fixed 2 permalink\",\n    \"className\": \"anchor before\"\n  }, mdx(\"svg\", {\n    parentName: \"a\",\n    \"aria-hidden\": \"true\",\n    \"focusable\": \"false\",\n    \"height\": \"16\",\n    \"version\": \"1.1\",\n    \"viewBox\": \"0 0 16 16\",\n    \"width\": \"16\"\n  }, mdx(\"path\", {\n    parentName: \"svg\",\n    \"fillRule\": \"evenodd\",\n    \"d\": \"M4 9h1v1H4c-1.5 0-3-1.69-3-3.5S2.55 3 4 3h4c1.45 0 3 1.69 3 3.5 0 1.41-.91 2.72-2 3.25V8.59c.58-.45 1-1.27 1-2.09C10 5.22 8.98 4 8 4H4c-.98 0-2 1.22-2 2.5S3 9 4 9zm9-3h-1v1h1c1 0 2 1.22 2 2.5S13.98 12 13 12H9c-.98 0-2-1.22-2-2.5 0-.83.42-1.64 1-2.09V6.25c-1.09.53-2 1.84-2 3.25C6 11.31 7.55 13 9 13h4c1.45 0 3-1.69 3-3.5S14.5 6 13 6z\"\n  }))), \"Bugs Fixed\"), mdx(\"ul\", null, mdx(\"li\", {\n    parentName: \"ul\"\n  }, \"Keyboard shortcut bindings were being \\\"stacked\\\" each time editor was closed and re-opened (#105).\"), mdx(\"li\", {\n    parentName: \"ul\"\n  }, \"Editor font size was not always immediately re-bound after minimizing and restoring the editor pane (#107).\")), mdx(\"h4\", {\n    \"id\": \"performance-and-stability-2\",\n    \"style\": {\n      \"position\": \"relative\"\n    }\n  }, mdx(\"a\", {\n    parentName: \"h4\",\n    \"href\": \"#performance-and-stability-2\",\n    \"aria-label\": \"performance and stability 2 permalink\",\n    \"className\": \"anchor before\"\n  }, mdx(\"svg\", {\n    parentName: \"a\",\n    \"aria-hidden\": \"true\",\n    \"focusable\": \"false\",\n    \"height\": \"16\",\n    \"version\": \"1.1\",\n    \"viewBox\": \"0 0 16 16\",\n    \"width\": \"16\"\n  }, mdx(\"path\", {\n    parentName: \"svg\",\n    \"fillRule\": \"evenodd\",\n    \"d\": \"M4 9h1v1H4c-1.5 0-3-1.69-3-3.5S2.55 3 4 3h4c1.45 0 3 1.69 3 3.5 0 1.41-.91 2.72-2 3.25V8.59c.58-.45 1-1.27 1-2.09C10 5.22 8.98 4 8 4H4c-.98 0-2 1.22-2 2.5S3 9 4 9zm9-3h-1v1h1c1 0 2 1.22 2 2.5S13.98 12 13 12H9c-.98 0-2-1.22-2-2.5 0-.83.42-1.64 1-2.09V6.25c-1.09.53-2 1.84-2 3.25C6 11.31 7.55 13 9 13h4c1.45 0 3-1.69 3-3.5S14.5 6 13 6z\"\n  }))), \"Performance and Stability\"), mdx(\"ul\", null, mdx(\"li\", {\n    parentName: \"ul\"\n  }, \"Second-stage of service layer re-write (continuing from 0.4). Again, this should result in no visible changes other than those detailed above.\"), mdx(\"li\", {\n    parentName: \"ul\"\n  }, \"Dependencies have been audited and replaced with latest/secure versions where possible.\")), mdx(\"h2\", {\n    \"id\": \"040-2021-07-26\",\n    \"style\": {\n      \"position\": \"relative\"\n    }\n  }, mdx(\"a\", {\n    parentName: \"h2\",\n    \"href\": \"#040-2021-07-26\",\n    \"aria-label\": \"040 2021 07 26 permalink\",\n    \"className\": \"anchor before\"\n  }, mdx(\"svg\", {\n    parentName: \"a\",\n    \"aria-hidden\": \"true\",\n    \"focusable\": \"false\",\n    \"height\": \"16\",\n    \"version\": \"1.1\",\n    \"viewBox\": \"0 0 16 16\",\n    \"width\": \"16\"\n  }, mdx(\"path\", {\n    parentName: \"svg\",\n    \"fillRule\": \"evenodd\",\n    \"d\": \"M4 9h1v1H4c-1.5 0-3-1.69-3-3.5S2.55 3 4 3h4c1.45 0 3 1.69 3 3.5 0 1.41-.91 2.72-2 3.25V8.59c.58-.45 1-1.27 1-2.09C10 5.22 8.98 4 8 4H4c-.98 0-2 1.22-2 2.5S3 9 4 9zm9-3h-1v1h1c1 0 2 1.22 2 2.5S13.98 12 13 12H9c-.98 0-2-1.22-2-2.5 0-.83.42-1.64 1-2.09V6.25c-1.09.53-2 1.84-2 3.25C6 11.31 7.55 13 9 13h4c1.45 0 3-1.69 3-3.5S14.5 6 13 6z\"\n  }))), \"0.4.0 (2021-07-26)\"), mdx(\"h4\", {\n    \"id\": \"new-features--enhancements\",\n    \"style\": {\n      \"position\": \"relative\"\n    }\n  }, mdx(\"a\", {\n    parentName: \"h4\",\n    \"href\": \"#new-features--enhancements\",\n    \"aria-label\": \"new features  enhancements permalink\",\n    \"className\": \"anchor before\"\n  }, mdx(\"svg\", {\n    parentName: \"a\",\n    \"aria-hidden\": \"true\",\n    \"focusable\": \"false\",\n    \"height\": \"16\",\n    \"version\": \"1.1\",\n    \"viewBox\": \"0 0 16 16\",\n    \"width\": \"16\"\n  }, mdx(\"path\", {\n    parentName: \"svg\",\n    \"fillRule\": \"evenodd\",\n    \"d\": \"M4 9h1v1H4c-1.5 0-3-1.69-3-3.5S2.55 3 4 3h4c1.45 0 3 1.69 3 3.5 0 1.41-.91 2.72-2 3.25V8.59c.58-.45 1-1.27 1-2.09C10 5.22 8.98 4 8 4H4c-.98 0-2 1.22-2 2.5S3 9 4 9zm9-3h-1v1h1c1 0 2 1.22 2 2.5S13.98 12 13 12H9c-.98 0-2-1.22-2-2.5 0-.83.42-1.64 1-2.09V6.25c-1.09.53-2 1.84-2 3.25C6 11.31 7.55 13 9 13h4c1.45 0 3-1.69 3-3.5S14.5 6 13 6z\"\n  }))), \"New Features & Enhancements\"), mdx(\"ul\", null, mdx(\"li\", {\n    parentName: \"ul\"\n  }, mdx(\"p\", {\n    parentName: \"li\"\n  }, \"Tooltip resolution has been improved:\"), mdx(\"ul\", {\n    parentName: \"li\"\n  }, mdx(\"li\", {\n    parentName: \"ul\"\n  }, \"Default tooltip formatting resolves better against data model (#8).\")), mdx(\"p\", {\n    parentName: \"li\"\n  }, mdx(\"img\", {\n    parentName: \"p\",\n    \"src\": \"/images/changelog/0.4-default-tooltip-formatting.png\",\n    \"alt\": \"0.4-default-tooltip-formatting.png\",\n    \"title\": \"Formatting is now applied to default tooltips, provided that the row context can be resolved, or the title of a tooltip field matches the display name passed-through in the visual data roles. This shows a comparison of default tooltip number formatting between version 0.3 and 0.4.\"\n  })), mdx(\"ul\", {\n    parentName: \"li\"\n  }, mdx(\"li\", {\n    parentName: \"ul\"\n  }, \"Report page tooltip resolution is more thorough for \", mdx(\"inlineCode\", {\n    parentName: \"li\"\n  }, \"transform\"), \"s that preserve row context (#37).\")), mdx(\"p\", {\n    parentName: \"li\"\n  }, \"Here's an example of behavior for a series of transforms that produces a \", mdx(\"em\", {\n    parentName: \"p\"\n  }, \"Top N + Others\"), \" dataset. The \", mdx(\"em\", {\n    parentName: \"p\"\n  }, \"Top N\"), \" results ultimately have the same grain as the source data so we can work out the correct selector for the data model. For \", mdx(\"em\", {\n    parentName: \"p\"\n  }, \"Others\"), \", we cannot resolve this, but can display a default tooltip (with better formatting resolution from above):\"), mdx(\"p\", {\n    parentName: \"li\"\n  }, mdx(\"img\", {\n    parentName: \"p\",\n    \"src\": \"/images/changelog/0.4-context-resolution-tooltip.gif\",\n    \"alt\": \"0.4-context-resolution-tooltip.gif\",\n    \"title\": \"Some transforms will remove the additional metadata we store to identify which row in the dataset that Power BI gives us. This animation demonstrates improvements made in 0.4 to try to identify the context algorithmically, and display a report page tooltip that uses that particular row context.\"\n  }))), mdx(\"li\", {\n    parentName: \"ul\"\n  }, mdx(\"p\", {\n    parentName: \"li\"\n  }, \"SVG is now the default render mode for visuals rather than canvas (#68). Please refer to the \", mdx(\"a\", {\n    parentName: \"p\",\n    \"href\": \"/performance-considerations#selection-of-renderer\"\n  }, \"Performance Considerations\"), \" page for further details on potential risks and mitigation approaches when it comes to selecting a renderer.\")), mdx(\"li\", {\n    parentName: \"ul\"\n  }, mdx(\"p\", {\n    parentName: \"li\"\n  }, \"Editor font size is now available in the properties pane. Refer to the \", mdx(\"a\", {\n    parentName: \"p\",\n    \"href\": \"/visual-editor#json-editor-font-size\"\n  }, \"Visual Editor\"), \" page for further details.\")), mdx(\"li\", {\n    parentName: \"ul\"\n  }, mdx(\"p\", {\n    parentName: \"li\"\n  }, \"Editors now track whether they are 'dirty', i.e. you've made changes but not yet applied them (#10).\"), mdx(\"ul\", {\n    parentName: \"li\"\n  }, mdx(\"li\", {\n    parentName: \"ul\"\n  }, \"The \", mdx(\"em\", {\n    parentName: \"li\"\n  }, \"Apply\"), \" button will be greyed-out if no changes have been made, or changes revert to the spec currently visible.\"), mdx(\"li\", {\n    parentName: \"ul\"\n  }, \"If exiting back to report view with unapplied changes, you will now get a 'last chance' prompt to apply any pending changes. Please refer to the \", mdx(\"a\", {\n    parentName: \"li\",\n    \"href\": \"/visual-editor#unapplied-changes\"\n  }, \"Visual Editor\"), \" page for more details if required.\"), mdx(\"li\", {\n    parentName: \"ul\"\n  }, \"If changes are discarded after choosing this option, they cannot be recovered.\"))), mdx(\"li\", {\n    parentName: \"ul\"\n  }, mdx(\"p\", {\n    parentName: \"li\"\n  }, \"Landing and status pages have better contrast and no redundant elements or styling (#40).\")), mdx(\"li\", {\n    parentName: \"ul\"\n  }, mdx(\"p\", {\n    parentName: \"li\"\n  }, \"If you're in the JSON editor and wish to navigate out of this with the keyboard (and presuming the operation shortcut keys are not useful), you can now press \", mdx(\"em\", {\n    parentName: \"p\"\n  }, \"[ Esc ]\"), \" to have Deneb set focus to the tabs above the editor (#25).\"))), mdx(\"h4\", {\n    \"id\": \"bugs-fixed-3\",\n    \"style\": {\n      \"position\": \"relative\"\n    }\n  }, mdx(\"a\", {\n    parentName: \"h4\",\n    \"href\": \"#bugs-fixed-3\",\n    \"aria-label\": \"bugs fixed 3 permalink\",\n    \"className\": \"anchor before\"\n  }, mdx(\"svg\", {\n    parentName: \"a\",\n    \"aria-hidden\": \"true\",\n    \"focusable\": \"false\",\n    \"height\": \"16\",\n    \"version\": \"1.1\",\n    \"viewBox\": \"0 0 16 16\",\n    \"width\": \"16\"\n  }, mdx(\"path\", {\n    parentName: \"svg\",\n    \"fillRule\": \"evenodd\",\n    \"d\": \"M4 9h1v1H4c-1.5 0-3-1.69-3-3.5S2.55 3 4 3h4c1.45 0 3 1.69 3 3.5 0 1.41-.91 2.72-2 3.25V8.59c.58-.45 1-1.27 1-2.09C10 5.22 8.98 4 8 4H4c-.98 0-2 1.22-2 2.5S3 9 4 9zm9-3h-1v1h1c1 0 2 1.22 2 2.5S13.98 12 13 12H9c-.98 0-2-1.22-2-2.5 0-.83.42-1.64 1-2.09V6.25c-1.09.53-2 1.84-2 3.25C6 11.31 7.55 13 9 13h4c1.45 0 3-1.69 3-3.5S14.5 6 13 6z\"\n  }))), \"Bugs Fixed\"), mdx(\"ul\", null, mdx(\"li\", {\n    parentName: \"ul\"\n  }, \"If you had selected a template file to import and tried to import it again (for instance, after editing it externally and wanting to re-import), this did not work. This has now been resolved (#36).\")), mdx(\"h4\", {\n    \"id\": \"performance--stability\",\n    \"style\": {\n      \"position\": \"relative\"\n    }\n  }, mdx(\"a\", {\n    parentName: \"h4\",\n    \"href\": \"#performance--stability\",\n    \"aria-label\": \"performance  stability permalink\",\n    \"className\": \"anchor before\"\n  }, mdx(\"svg\", {\n    parentName: \"a\",\n    \"aria-hidden\": \"true\",\n    \"focusable\": \"false\",\n    \"height\": \"16\",\n    \"version\": \"1.1\",\n    \"viewBox\": \"0 0 16 16\",\n    \"width\": \"16\"\n  }, mdx(\"path\", {\n    parentName: \"svg\",\n    \"fillRule\": \"evenodd\",\n    \"d\": \"M4 9h1v1H4c-1.5 0-3-1.69-3-3.5S2.55 3 4 3h4c1.45 0 3 1.69 3 3.5 0 1.41-.91 2.72-2 3.25V8.59c.58-.45 1-1.27 1-2.09C10 5.22 8.98 4 8 4H4c-.98 0-2 1.22-2 2.5S3 9 4 9zm9-3h-1v1h1c1 0 2 1.22 2 2.5S13.98 12 13 12H9c-.98 0-2-1.22-2-2.5 0-.83.42-1.64 1-2.09V6.25c-1.09.53-2 1.84-2 3.25C6 11.31 7.55 13 9 13h4c1.45 0 3-1.69 3-3.5S14.5 6 13 6z\"\n  }))), \"Performance & Stability\"), mdx(\"ul\", null, mdx(\"li\", {\n    parentName: \"ul\"\n  }, \"Application icons have been optimized and initialization is now much more performant on first run (#77).\"), mdx(\"li\", {\n    parentName: \"ul\"\n  }, \"Deneb service layer has been completely re-written as part of ongoing review and optimizations. All being well, this should result in no visible changes for you \\uD83D\\uDE42\"), mdx(\"li\", {\n    parentName: \"ul\"\n  }, \"The packaged visual (.pbiviz) is ~10% smaller (1.35MB > 1.22MB).\")), mdx(\"h2\", {\n    \"id\": \"030-2021-05-31\",\n    \"style\": {\n      \"position\": \"relative\"\n    }\n  }, mdx(\"a\", {\n    parentName: \"h2\",\n    \"href\": \"#030-2021-05-31\",\n    \"aria-label\": \"030 2021 05 31 permalink\",\n    \"className\": \"anchor before\"\n  }, mdx(\"svg\", {\n    parentName: \"a\",\n    \"aria-hidden\": \"true\",\n    \"focusable\": \"false\",\n    \"height\": \"16\",\n    \"version\": \"1.1\",\n    \"viewBox\": \"0 0 16 16\",\n    \"width\": \"16\"\n  }, mdx(\"path\", {\n    parentName: \"svg\",\n    \"fillRule\": \"evenodd\",\n    \"d\": \"M4 9h1v1H4c-1.5 0-3-1.69-3-3.5S2.55 3 4 3h4c1.45 0 3 1.69 3 3.5 0 1.41-.91 2.72-2 3.25V8.59c.58-.45 1-1.27 1-2.09C10 5.22 8.98 4 8 4H4c-.98 0-2 1.22-2 2.5S3 9 4 9zm9-3h-1v1h1c1 0 2 1.22 2 2.5S13.98 12 13 12H9c-.98 0-2-1.22-2-2.5 0-.83.42-1.64 1-2.09V6.25c-1.09.53-2 1.84-2 3.25C6 11.31 7.55 13 9 13h4c1.45 0 3-1.69 3-3.5S14.5 6 13 6z\"\n  }))), \"0.3.0 (2021-05-31)\"), mdx(\"h4\", {\n    \"id\": \"new-features--enhancements-1\",\n    \"style\": {\n      \"position\": \"relative\"\n    }\n  }, mdx(\"a\", {\n    parentName: \"h4\",\n    \"href\": \"#new-features--enhancements-1\",\n    \"aria-label\": \"new features  enhancements 1 permalink\",\n    \"className\": \"anchor before\"\n  }, mdx(\"svg\", {\n    parentName: \"a\",\n    \"aria-hidden\": \"true\",\n    \"focusable\": \"false\",\n    \"height\": \"16\",\n    \"version\": \"1.1\",\n    \"viewBox\": \"0 0 16 16\",\n    \"width\": \"16\"\n  }, mdx(\"path\", {\n    parentName: \"svg\",\n    \"fillRule\": \"evenodd\",\n    \"d\": \"M4 9h1v1H4c-1.5 0-3-1.69-3-3.5S2.55 3 4 3h4c1.45 0 3 1.69 3 3.5 0 1.41-.91 2.72-2 3.25V8.59c.58-.45 1-1.27 1-2.09C10 5.22 8.98 4 8 4H4c-.98 0-2 1.22-2 2.5S3 9 4 9zm9-3h-1v1h1c1 0 2 1.22 2 2.5S13.98 12 13 12H9c-.98 0-2-1.22-2-2.5 0-.83.42-1.64 1-2.09V6.25c-1.09.53-2 1.84-2 3.25C6 11.31 7.55 13 9 13h4c1.45 0 3-1.69 3-3.5S14.5 6 13 6z\"\n  }))), \"New Features & Enhancements\"), mdx(\"ul\", null, mdx(\"li\", {\n    parentName: \"ul\"\n  }, mdx(\"p\", {\n    parentName: \"li\"\n  }, \"Template import and generation added. This is covered more in the \", mdx(\"a\", {\n    parentName: \"p\",\n    \"href\": \"/templates\"\n  }, \"Templates\"), \" page, but high-level features are as follows:\"), mdx(\"ul\", {\n    parentName: \"li\"\n  }, mdx(\"li\", {\n    parentName: \"ul\"\n  }, \"When editing a specification, there is now a \", mdx(\"em\", {\n    parentName: \"li\"\n  }, \"Generate JSON Template\"), \" button in the editor.\"), mdx(\"li\", {\n    parentName: \"ul\"\n  }, \"Selecting this presents a dialog that an author can use to customize aspects of the specification, prior to export to (a) provide descriptive detail for anyone wanting to import the template, and (b) make column and measure metadata more suitable for general consumption (particularly if sensitive names are used).\"), mdx(\"li\", {\n    parentName: \"ul\"\n  }, \"The template JSON is made available for you to review and then copy to the clipboard. This can then be saved as a \", mdx(\"inlineCode\", {\n    parentName: \"li\"\n  }, \".json\"), \" file for import by yourself or others.\"), mdx(\"li\", {\n    parentName: \"ul\"\n  }, \"Additionally, the \", mdx(\"em\", {\n    parentName: \"li\"\n  }, \"Create New Specification\"), \" dialog has an additional \", mdx(\"em\", {\n    parentName: \"li\"\n  }, \"Import from Template\"), \" tab. Here you can import a valid Deneb template (generated using the above functionality) and allocate columns and measures from your \", mdx(\"em\", {\n    parentName: \"li\"\n  }, \"Values\"), \" data role, in the same way as the built-in examples.\"))), mdx(\"li\", {\n    parentName: \"ul\"\n  }, mdx(\"p\", {\n    parentName: \"li\"\n  }, \"[INTERNAL]\", \" the data view mapping has been swapped from \", mdx(\"inlineCode\", {\n    parentName: \"p\"\n  }, \"table\"), \" to \", mdx(\"inlineCode\", {\n    parentName: \"p\"\n  }, \"categorical\"), \".\"), mdx(\"ul\", {\n    parentName: \"li\"\n  }, mdx(\"li\", {\n    parentName: \"ul\"\n  }, \"This currently results in no net change for end-users, but will potentially allow us more functionality with selectors than the \", mdx(\"inlineCode\", {\n    parentName: \"li\"\n  }, \"table\"), \" data view mapping offers.\"), mdx(\"li\", {\n    parentName: \"ul\"\n  }, \"One such benefit is that to date, a report page tooltip could only be created and referenced using a column from the dataset; we can now use a single measure if we so want.\")))), mdx(\"h4\", {\n    \"id\": \"bugs-fixed-4\",\n    \"style\": {\n      \"position\": \"relative\"\n    }\n  }, mdx(\"a\", {\n    parentName: \"h4\",\n    \"href\": \"#bugs-fixed-4\",\n    \"aria-label\": \"bugs fixed 4 permalink\",\n    \"className\": \"anchor before\"\n  }, mdx(\"svg\", {\n    parentName: \"a\",\n    \"aria-hidden\": \"true\",\n    \"focusable\": \"false\",\n    \"height\": \"16\",\n    \"version\": \"1.1\",\n    \"viewBox\": \"0 0 16 16\",\n    \"width\": \"16\"\n  }, mdx(\"path\", {\n    parentName: \"svg\",\n    \"fillRule\": \"evenodd\",\n    \"d\": \"M4 9h1v1H4c-1.5 0-3-1.69-3-3.5S2.55 3 4 3h4c1.45 0 3 1.69 3 3.5 0 1.41-.91 2.72-2 3.25V8.59c.58-.45 1-1.27 1-2.09C10 5.22 8.98 4 8 4H4c-.98 0-2 1.22-2 2.5S3 9 4 9zm9-3h-1v1h1c1 0 2 1.22 2 2.5S13.98 12 13 12H9c-.98 0-2-1.22-2-2.5 0-.83.42-1.64 1-2.09V6.25c-1.09.53-2 1.84-2 3.25C6 11.31 7.55 13 9 13h4c1.45 0 3-1.69 3-3.5S14.5 6 13 6z\"\n  }))), \"Bugs Fixed\"), mdx(\"ul\", null, mdx(\"li\", {\n    parentName: \"ul\"\n  }, \"If overriding the visual \", mdx(\"inlineCode\", {\n    parentName: \"li\"\n  }, \"data\"), \" within the specification (e.g. when pasting in an example with static data), or adding custom datasets for a particular layer, then Deneb would refuse to render. This has been fixed. (#33)\"), mdx(\"li\", {\n    parentName: \"ul\"\n  }, \"Columns or measures added from the data model containing characters that require special handling, now have these characters replaced in the dataset. Refer to the \", mdx(\"a\", {\n    parentName: \"li\",\n    \"href\": \"visual-dataset-binding/#special-characters-in-column-and-measure-names\"\n  }, \"documentation regarding this\"), \" for further details (#38)\")), mdx(\"h2\", {\n    \"id\": \"020-2021-03-19\",\n    \"style\": {\n      \"position\": \"relative\"\n    }\n  }, mdx(\"a\", {\n    parentName: \"h2\",\n    \"href\": \"#020-2021-03-19\",\n    \"aria-label\": \"020 2021 03 19 permalink\",\n    \"className\": \"anchor before\"\n  }, mdx(\"svg\", {\n    parentName: \"a\",\n    \"aria-hidden\": \"true\",\n    \"focusable\": \"false\",\n    \"height\": \"16\",\n    \"version\": \"1.1\",\n    \"viewBox\": \"0 0 16 16\",\n    \"width\": \"16\"\n  }, mdx(\"path\", {\n    parentName: \"svg\",\n    \"fillRule\": \"evenodd\",\n    \"d\": \"M4 9h1v1H4c-1.5 0-3-1.69-3-3.5S2.55 3 4 3h4c1.45 0 3 1.69 3 3.5 0 1.41-.91 2.72-2 3.25V8.59c.58-.45 1-1.27 1-2.09C10 5.22 8.98 4 8 4H4c-.98 0-2 1.22-2 2.5S3 9 4 9zm9-3h-1v1h1c1 0 2 1.22 2 2.5S13.98 12 13 12H9c-.98 0-2-1.22-2-2.5 0-.83.42-1.64 1-2.09V6.25c-1.09.53-2 1.84-2 3.25C6 11.31 7.55 13 9 13h4c1.45 0 3-1.69 3-3.5S14.5 6 13 6z\"\n  }))), \"0.2.0 (2021-03-19)\"), mdx(\"h4\", {\n    \"id\": \"new-features--enhancements-2\",\n    \"style\": {\n      \"position\": \"relative\"\n    }\n  }, mdx(\"a\", {\n    parentName: \"h4\",\n    \"href\": \"#new-features--enhancements-2\",\n    \"aria-label\": \"new features  enhancements 2 permalink\",\n    \"className\": \"anchor before\"\n  }, mdx(\"svg\", {\n    parentName: \"a\",\n    \"aria-hidden\": \"true\",\n    \"focusable\": \"false\",\n    \"height\": \"16\",\n    \"version\": \"1.1\",\n    \"viewBox\": \"0 0 16 16\",\n    \"width\": \"16\"\n  }, mdx(\"path\", {\n    parentName: \"svg\",\n    \"fillRule\": \"evenodd\",\n    \"d\": \"M4 9h1v1H4c-1.5 0-3-1.69-3-3.5S2.55 3 4 3h4c1.45 0 3 1.69 3 3.5 0 1.41-.91 2.72-2 3.25V8.59c.58-.45 1-1.27 1-2.09C10 5.22 8.98 4 8 4H4c-.98 0-2 1.22-2 2.5S3 9 4 9zm9-3h-1v1h1c1 0 2 1.22 2 2.5S13.98 12 13 12H9c-.98 0-2-1.22-2-2.5 0-.83.42-1.64 1-2.09V6.25c-1.09.53-2 1.84-2 3.25C6 11.31 7.55 13 9 13h4c1.45 0 3-1.69 3-3.5S14.5 6 13 6z\"\n  }))), \"New Features & Enhancements\"), mdx(\"ul\", null, mdx(\"li\", {\n    parentName: \"ul\"\n  }, \"Custom formatter added, which if specified, allows creators to use Power BI format strings instead of D3 ones. Refer to \", mdx(\"a\", {\n    parentName: \"li\",\n    \"href\": \"/formatting-values\"\n  }, \"Formatting Values\"), \" page for details (#13)\"), mdx(\"li\", {\n    parentName: \"ul\"\n  }, \"Keyboard shortcuts now available for all portions of the advanced UI; not just when a user is inside the specification or config editor (#23)\"), mdx(\"li\", {\n    parentName: \"ul\"\n  }, \"Editor pane toggle has keyboard shortcut - \", mdx(\"inlineCode\", {\n    parentName: \"li\"\n  }, \"Ctrl + Alt + Space\"), \" (#24)\"), mdx(\"li\", {\n    parentName: \"ul\"\n  }, \"Editor tabs now have shortcuts (#2):\", mdx(\"ul\", {\n    parentName: \"li\"\n  }, mdx(\"li\", {\n    parentName: \"ul\"\n  }, \"Specification - \", mdx(\"inlineCode\", {\n    parentName: \"li\"\n  }, \"Ctrl + Alt + 1\")), mdx(\"li\", {\n    parentName: \"ul\"\n  }, \"Config - \", mdx(\"inlineCode\", {\n    parentName: \"li\"\n  }, \"Ctrl + Alt + 2\")), mdx(\"li\", {\n    parentName: \"ul\"\n  }, \"Settings - \", mdx(\"inlineCode\", {\n    parentName: \"li\"\n  }, \"Ctrl + Alt + 3\")))), mdx(\"li\", {\n    parentName: \"ul\"\n  }, \"Added switchable locale in dev tools, which will assist with debugging formatting and other i18n stuff (#19)\")), mdx(\"h4\", {\n    \"id\": \"bugs-fixed-5\",\n    \"style\": {\n      \"position\": \"relative\"\n    }\n  }, mdx(\"a\", {\n    parentName: \"h4\",\n    \"href\": \"#bugs-fixed-5\",\n    \"aria-label\": \"bugs fixed 5 permalink\",\n    \"className\": \"anchor before\"\n  }, mdx(\"svg\", {\n    parentName: \"a\",\n    \"aria-hidden\": \"true\",\n    \"focusable\": \"false\",\n    \"height\": \"16\",\n    \"version\": \"1.1\",\n    \"viewBox\": \"0 0 16 16\",\n    \"width\": \"16\"\n  }, mdx(\"path\", {\n    parentName: \"svg\",\n    \"fillRule\": \"evenodd\",\n    \"d\": \"M4 9h1v1H4c-1.5 0-3-1.69-3-3.5S2.55 3 4 3h4c1.45 0 3 1.69 3 3.5 0 1.41-.91 2.72-2 3.25V8.59c.58-.45 1-1.27 1-2.09C10 5.22 8.98 4 8 4H4c-.98 0-2 1.22-2 2.5S3 9 4 9zm9-3h-1v1h1c1 0 2 1.22 2 2.5S13.98 12 13 12H9c-.98 0-2-1.22-2-2.5 0-.83.42-1.64 1-2.09V6.25c-1.09.53-2 1.84-2 3.25C6 11.31 7.55 13 9 13h4c1.45 0 3-1.69 3-3.5S14.5 6 13 6z\"\n  }))), \"Bugs Fixed\"), mdx(\"ul\", null, mdx(\"li\", {\n    parentName: \"ul\"\n  }, \"Toggling the editor pane lost any changes in-progress. This has been amended to apply changes prior to unmounting the 'expanded' view.\"), mdx(\"li\", {\n    parentName: \"ul\"\n  }, \"Vega templates had incorrect reference to \", mdx(\"inlineCode\", {\n    parentName: \"li\"\n  }, \"values\"), \" named dataset, rather than \", mdx(\"inlineCode\", {\n    parentName: \"li\"\n  }, \"dataset\"), \". These have been re-pointed to be correct.\")), mdx(\"h4\", {\n    \"id\": \"housekeeping\",\n    \"style\": {\n      \"position\": \"relative\"\n    }\n  }, mdx(\"a\", {\n    parentName: \"h4\",\n    \"href\": \"#housekeeping\",\n    \"aria-label\": \"housekeeping permalink\",\n    \"className\": \"anchor before\"\n  }, mdx(\"svg\", {\n    parentName: \"a\",\n    \"aria-hidden\": \"true\",\n    \"focusable\": \"false\",\n    \"height\": \"16\",\n    \"version\": \"1.1\",\n    \"viewBox\": \"0 0 16 16\",\n    \"width\": \"16\"\n  }, mdx(\"path\", {\n    parentName: \"svg\",\n    \"fillRule\": \"evenodd\",\n    \"d\": \"M4 9h1v1H4c-1.5 0-3-1.69-3-3.5S2.55 3 4 3h4c1.45 0 3 1.69 3 3.5 0 1.41-.91 2.72-2 3.25V8.59c.58-.45 1-1.27 1-2.09C10 5.22 8.98 4 8 4H4c-.98 0-2 1.22-2 2.5S3 9 4 9zm9-3h-1v1h1c1 0 2 1.22 2 2.5S13.98 12 13 12H9c-.98 0-2-1.22-2-2.5 0-.83.42-1.64 1-2.09V6.25c-1.09.53-2 1.84-2 3.25C6 11.31 7.55 13 9 13h4c1.45 0 3-1.69 3-3.5S14.5 6 13 6z\"\n  }))), \"Housekeeping\"), mdx(\"ul\", null, mdx(\"li\", {\n    parentName: \"ul\"\n  }, \"Fixed linting issues with chevron icon in header (#17)\"), mdx(\"li\", {\n    parentName: \"ul\"\n  }, \"Renamed anything to do with editor pane sizing to be more appropriate for the current interface logic (#14)\")), mdx(\"h2\", {\n    \"id\": \"010-2021-03-15\",\n    \"style\": {\n      \"position\": \"relative\"\n    }\n  }, mdx(\"a\", {\n    parentName: \"h2\",\n    \"href\": \"#010-2021-03-15\",\n    \"aria-label\": \"010 2021 03 15 permalink\",\n    \"className\": \"anchor before\"\n  }, mdx(\"svg\", {\n    parentName: \"a\",\n    \"aria-hidden\": \"true\",\n    \"focusable\": \"false\",\n    \"height\": \"16\",\n    \"version\": \"1.1\",\n    \"viewBox\": \"0 0 16 16\",\n    \"width\": \"16\"\n  }, mdx(\"path\", {\n    parentName: \"svg\",\n    \"fillRule\": \"evenodd\",\n    \"d\": \"M4 9h1v1H4c-1.5 0-3-1.69-3-3.5S2.55 3 4 3h4c1.45 0 3 1.69 3 3.5 0 1.41-.91 2.72-2 3.25V8.59c.58-.45 1-1.27 1-2.09C10 5.22 8.98 4 8 4H4c-.98 0-2 1.22-2 2.5S3 9 4 9zm9-3h-1v1h1c1 0 2 1.22 2 2.5S13.98 12 13 12H9c-.98 0-2-1.22-2-2.5 0-.83.42-1.64 1-2.09V6.25c-1.09.53-2 1.84-2 3.25C6 11.31 7.55 13 9 13h4c1.45 0 3-1.69 3-3.5S14.5 6 13 6z\"\n  }))), \"0.1.0 (2021-03-15)\"), mdx(\"p\", null, \"Initial beta release for early access.\"));\n}\n;\nMDXContent.isMDXComponent = true;","headings":[{"depth":2,"value":"1.0.0 (2021-11-13)"},{"depth":4,"value":"IMPORTANT NOTES"},{"depth":4,"value":"Bugs Fixed"},{"depth":4,"value":"Performance and Stability"},{"depth":2,"value":"0.6.0 (2021-10-11)"},{"depth":4,"value":"IMPORTANT NOTES"},{"depth":4,"value":"New Features and Enhancements"},{"depth":4,"value":"Bugs Fixed"},{"depth":4,"value":"Performance and Stability"},{"depth":2,"value":"0.5.0 (2021-08-30)"},{"depth":4,"value":"New Features and Enhancements"},{"depth":4,"value":"Bugs Fixed"},{"depth":4,"value":"Performance and Stability"},{"depth":2,"value":"0.4.0 (2021-07-26)"},{"depth":4,"value":"New Features & Enhancements"},{"depth":4,"value":"Bugs Fixed"},{"depth":4,"value":"Performance & Stability"},{"depth":2,"value":"0.3.0 (2021-05-31)"},{"depth":4,"value":"New Features & Enhancements"},{"depth":4,"value":"Bugs Fixed"},{"depth":2,"value":"0.2.0 (2021-03-19)"},{"depth":4,"value":"New Features & Enhancements"},{"depth":4,"value":"Bugs Fixed"},{"depth":4,"value":"Housekeeping"},{"depth":2,"value":"0.1.0 (2021-03-15)"}]}},"pageContext":{"slug":"/changelog/","prev":{"label":"FAQ","link":"/faq"},"next":{"label":"Contributors","link":"/contributors"},"repositoryEditUrl":"https://github.com/deneb-viz/deneb-viz.github.io/tree/source/src/docs/changelog.mdx","repositoryProvider":"GitHub"}},
    "staticQueryHashes": ["1954253342","2328931024","2501019404","973074209"]}