{
    "componentChunkName": "component---node-modules-rocketseat-gatsby-theme-docs-core-src-templates-docs-query-js",
    "path": "/interactivity-features-overview",
    "result": {"data":{"mdx":{"id":"8c486cfa-6f34-5877-b64a-86d8cacd82bb","excerpt":"Power BI provides the ability to create visuals using  R  and  Python . Whilst these extend your options significantly, these are typically rendered as a staticâ€¦","fields":{"slug":"/interactivity-features-overview/"},"frontmatter":{"title":"Interactivity Features - Overview","description":"Getting started with understanding Deneb <> Power BI interactivity.","image":"/images/favicon.png","disableTableOfContents":false},"body":"var _excluded = [\"components\"];\n\nfunction _extends() { _extends = Object.assign || function (target) { for (var i = 1; i < arguments.length; i++) { var source = arguments[i]; for (var key in source) { if (Object.prototype.hasOwnProperty.call(source, key)) { target[key] = source[key]; } } } return target; }; return _extends.apply(this, arguments); }\n\nfunction _objectWithoutProperties(source, excluded) { if (source == null) return {}; var target = _objectWithoutPropertiesLoose(source, excluded); var key, i; if (Object.getOwnPropertySymbols) { var sourceSymbolKeys = Object.getOwnPropertySymbols(source); for (i = 0; i < sourceSymbolKeys.length; i++) { key = sourceSymbolKeys[i]; if (excluded.indexOf(key) >= 0) continue; if (!Object.prototype.propertyIsEnumerable.call(source, key)) continue; target[key] = source[key]; } } return target; }\n\nfunction _objectWithoutPropertiesLoose(source, excluded) { if (source == null) return {}; var target = {}; var sourceKeys = Object.keys(source); var key, i; for (i = 0; i < sourceKeys.length; i++) { key = sourceKeys[i]; if (excluded.indexOf(key) >= 0) continue; target[key] = source[key]; } return target; }\n\n/* @jsxRuntime classic */\n\n/* @jsx mdx */\nvar _frontmatter = {\n  \"title\": \"Interactivity Features - Overview\",\n  \"description\": \"Getting started with understanding Deneb <> Power BI interactivity.\",\n  \"image\": \"/images/favicon.png\",\n  \"disableTableOfContents\": false\n};\nvar layoutProps = {\n  _frontmatter: _frontmatter\n};\nvar MDXLayout = \"wrapper\";\nreturn function MDXContent(_ref) {\n  var components = _ref.components,\n      props = _objectWithoutProperties(_ref, _excluded);\n\n  return mdx(MDXLayout, _extends({}, layoutProps, props, {\n    components: components,\n    mdxType: \"MDXLayout\"\n  }), mdx(\"p\", null, \"Power BI provides the ability to create visuals using \", mdx(OutboundLink, {\n    href: \"https://docs.microsoft.com/en-us/power-bi/create-reports/desktop-r-visuals?WT.mc_id=DP-MVP-5003712\",\n    target: \"_blank\",\n    mdxType: \"OutboundLink\"\n  }, \"R\"), \" and \", mdx(OutboundLink, {\n    href: \"https://docs.microsoft.com/en-us/power-bi/connect-data/desktop-python-visuals?WT.mc_id=DP-MVP-5003712\",\n    target: \"_blank\",\n    mdxType: \"OutboundLink\"\n  }, \"Python\"), \". Whilst these extend your options significantly, these are typically rendered as a static image and mean that it's currently not possible for you to interact back from these visuals to the rest of the report.\"), mdx(\"p\", null, \"On occasion, these visuals may also require some additional dependencies if you want to share with a wider pool of end-users, or a library may not be available in the Power BI Service when it comes to deployment.\"), mdx(\"h2\", {\n    \"id\": \"how-deneb-can-be-different-from-r--python-options\",\n    \"style\": {\n      \"position\": \"relative\"\n    }\n  }, mdx(\"a\", {\n    parentName: \"h2\",\n    \"href\": \"#how-deneb-can-be-different-from-r--python-options\",\n    \"aria-label\": \"how deneb can be different from r  python options permalink\",\n    \"className\": \"anchor before\"\n  }, mdx(\"svg\", {\n    parentName: \"a\",\n    \"aria-hidden\": \"true\",\n    \"focusable\": \"false\",\n    \"height\": \"16\",\n    \"version\": \"1.1\",\n    \"viewBox\": \"0 0 16 16\",\n    \"width\": \"16\"\n  }, mdx(\"path\", {\n    parentName: \"svg\",\n    \"fillRule\": \"evenodd\",\n    \"d\": \"M4 9h1v1H4c-1.5 0-3-1.69-3-3.5S2.55 3 4 3h4c1.45 0 3 1.69 3 3.5 0 1.41-.91 2.72-2 3.25V8.59c.58-.45 1-1.27 1-2.09C10 5.22 8.98 4 8 4H4c-.98 0-2 1.22-2 2.5S3 9 4 9zm9-3h-1v1h1c1 0 2 1.22 2 2.5S13.98 12 13 12H9c-.98 0-2-1.22-2-2.5 0-.83.42-1.64 1-2.09V6.25c-1.09.53-2 1.84-2 3.25C6 11.31 7.55 13 9 13h4c1.45 0 3-1.69 3-3.5S14.5 6 13 6z\"\n  }))), \"How Deneb Can Be Different from R & Python Options\"), mdx(\"p\", null, \"In addition to the JSON-based declarative syntax, Deneb is packaged with the Vega and Vega-Lite libraries. Because they are built for the web, anything you produce should ideally be portable within the Power BI ecosystem, irrespective of which device you're using.\"), mdx(\"p\", null, \"Both \", mdx(OutboundLink, {\n    href: \"https://vega.github.io/vega/docs/event-streams/\",\n    target: \"_blank\",\n    mdxType: \"OutboundLink\"\n  }, \" Vega\"), \" and \", mdx(OutboundLink, {\n    href: \"https://vega.github.io/vega-lite/docs/selection.html\",\n    target: \"_blank\",\n    mdxType: \"OutboundLink\"\n  }, \"Vega-Lite\"), \" have their own approaches to interactivity and it's only logical to start thinking about how we can make use of this to make the visual \\\"fit in\\\" with the functionality on offer in other Power BI visuals...\"), mdx(\"h2\", {\n    \"id\": \"managing-your-expectations\",\n    \"style\": {\n      \"position\": \"relative\"\n    }\n  }, mdx(\"a\", {\n    parentName: \"h2\",\n    \"href\": \"#managing-your-expectations\",\n    \"aria-label\": \"managing your expectations permalink\",\n    \"className\": \"anchor before\"\n  }, mdx(\"svg\", {\n    parentName: \"a\",\n    \"aria-hidden\": \"true\",\n    \"focusable\": \"false\",\n    \"height\": \"16\",\n    \"version\": \"1.1\",\n    \"viewBox\": \"0 0 16 16\",\n    \"width\": \"16\"\n  }, mdx(\"path\", {\n    parentName: \"svg\",\n    \"fillRule\": \"evenodd\",\n    \"d\": \"M4 9h1v1H4c-1.5 0-3-1.69-3-3.5S2.55 3 4 3h4c1.45 0 3 1.69 3 3.5 0 1.41-.91 2.72-2 3.25V8.59c.58-.45 1-1.27 1-2.09C10 5.22 8.98 4 8 4H4c-.98 0-2 1.22-2 2.5S3 9 4 9zm9-3h-1v1h1c1 0 2 1.22 2 2.5S13.98 12 13 12H9c-.98 0-2-1.22-2-2.5 0-.83.42-1.64 1-2.09V6.25c-1.09.53-2 1.84-2 3.25C6 11.31 7.55 13 9 13h4c1.45 0 3-1.69 3-3.5S14.5 6 13 6z\"\n  }))), \"Managing your Expectations\"), mdx(\"p\", null, \"The interactivity part is one of the harder elements of developing your own custom visual and as such, it's going to be challenging to make this work in a visual like Deneb in a generic way, particularly as the Vega tooling provides a lot of creative freedom.\"), mdx(\"p\", null, \"We fundamentally have three challenges when it comes to building visuals that are interactive within Power BI:\"), mdx(\"ol\", null, mdx(\"li\", {\n    parentName: \"ol\"\n  }, mdx(\"p\", {\n    parentName: \"li\"\n  }, \"Ensuring that Deneb visuals can interact with the main Power BI window (which handles interactivity events on a visual's behalf).\")), mdx(\"li\", {\n    parentName: \"ol\"\n  }, mdx(\"p\", {\n    parentName: \"li\"\n  }, \"Reconciling data and row context to other visuals or the data model when events happen in our visual.\")), mdx(\"li\", {\n    parentName: \"ol\"\n  }, mdx(\"p\", {\n    parentName: \"li\"\n  }, \"Prescribing how the our visual should behave and respond \", mdx(\"em\", {\n    parentName: \"p\"\n  }, \"visually\"), \" when our end-users interact with it.\"))), mdx(\"p\", null, \"As such, we have some considerations to make when trying to deliver functionality are interactivity so that you can produce visuals that look and feel at home in Power BI, and your end-users get a consistent experience with your visual vs. others.\"), mdx(\"p\", null, \"The below is going to attempt to summarize some of the considerations we need to think about and this is a challenge to do concisely. For a deeper understanding, you're welcome to dive into the \", mdx(OutboundLink, {\n    href: \"https://docs.microsoft.com/en-us/power-bi/developer/visuals?WT.mc_id=DP-MVP-5003712\",\n    target: \"_blank\",\n    mdxType: \"OutboundLink\"\n  }, \"developer documentation for visuals\"), \".\"), mdx(\"h2\", {\n    \"id\": \"reconciliation-of-data-andor-row-context\",\n    \"style\": {\n      \"position\": \"relative\"\n    }\n  }, mdx(\"a\", {\n    parentName: \"h2\",\n    \"href\": \"#reconciliation-of-data-andor-row-context\",\n    \"aria-label\": \"reconciliation of data andor row context permalink\",\n    \"className\": \"anchor before\"\n  }, mdx(\"svg\", {\n    parentName: \"a\",\n    \"aria-hidden\": \"true\",\n    \"focusable\": \"false\",\n    \"height\": \"16\",\n    \"version\": \"1.1\",\n    \"viewBox\": \"0 0 16 16\",\n    \"width\": \"16\"\n  }, mdx(\"path\", {\n    parentName: \"svg\",\n    \"fillRule\": \"evenodd\",\n    \"d\": \"M4 9h1v1H4c-1.5 0-3-1.69-3-3.5S2.55 3 4 3h4c1.45 0 3 1.69 3 3.5 0 1.41-.91 2.72-2 3.25V8.59c.58-.45 1-1.27 1-2.09C10 5.22 8.98 4 8 4H4c-.98 0-2 1.22-2 2.5S3 9 4 9zm9-3h-1v1h1c1 0 2 1.22 2 2.5S13.98 12 13 12H9c-.98 0-2-1.22-2-2.5 0-.83.42-1.64 1-2.09V6.25c-1.09.53-2 1.84-2 3.25C6 11.31 7.55 13 9 13h4c1.45 0 3-1.69 3-3.5S14.5 6 13 6z\"\n  }))), \"Reconciliation of Data and/or Row Context\"), mdx(\"h3\", {\n    \"id\": \"getting-data-from-the-model\",\n    \"style\": {\n      \"position\": \"relative\"\n    }\n  }, mdx(\"a\", {\n    parentName: \"h3\",\n    \"href\": \"#getting-data-from-the-model\",\n    \"aria-label\": \"getting data from the model permalink\",\n    \"className\": \"anchor before\"\n  }, mdx(\"svg\", {\n    parentName: \"a\",\n    \"aria-hidden\": \"true\",\n    \"focusable\": \"false\",\n    \"height\": \"16\",\n    \"version\": \"1.1\",\n    \"viewBox\": \"0 0 16 16\",\n    \"width\": \"16\"\n  }, mdx(\"path\", {\n    parentName: \"svg\",\n    \"fillRule\": \"evenodd\",\n    \"d\": \"M4 9h1v1H4c-1.5 0-3-1.69-3-3.5S2.55 3 4 3h4c1.45 0 3 1.69 3 3.5 0 1.41-.91 2.72-2 3.25V8.59c.58-.45 1-1.27 1-2.09C10 5.22 8.98 4 8 4H4c-.98 0-2 1.22-2 2.5S3 9 4 9zm9-3h-1v1h1c1 0 2 1.22 2 2.5S13.98 12 13 12H9c-.98 0-2-1.22-2-2.5 0-.83.42-1.64 1-2.09V6.25c-1.09.53-2 1.84-2 3.25C6 11.31 7.55 13 9 13h4c1.45 0 3-1.69 3-3.5S14.5 6 13 6z\"\n  }))), \"Getting Data from the Model\"), mdx(\"ul\", null, mdx(\"li\", {\n    parentName: \"ul\"\n  }, mdx(\"p\", {\n    parentName: \"li\"\n  }, \"Visuals in Power BI can't read from the model of their own volition - they are effectively ring-fenced away from the main interface for a lot of (sensible) reasons.\")), mdx(\"li\", {\n    parentName: \"ul\"\n  }, mdx(\"p\", {\n    parentName: \"li\"\n  }, \"When you add columns and measures to the data roles, this is part of Power BI's interface, rather than the visual's.\")), mdx(\"li\", {\n    parentName: \"ul\"\n  }, mdx(\"p\", {\n    parentName: \"li\"\n  }, \"Power BI looks at all of these, plus the current filter context and runs a DAX query on the visual's behalf.\"))), mdx(\"p\", null, \"To illustrate, we can use the Financial sample dataset that comes with Power BI Desktop to add the \", mdx(\"inlineCode\", {\n    parentName: \"p\"\n  }, \"Country\"), \" column and specify a sum of \", mdx(\"inlineCode\", {\n    parentName: \"p\"\n  }, \"Sales\"), \" to Deneb's \", mdx(\"em\", {\n    parentName: \"p\"\n  }, \"Values\"), \" data role:\"), mdx(\"p\", null, mdx(\"img\", {\n    parentName: \"p\",\n    \"src\": \"/images/interactivity/simple-column-and-measure-roles.png\",\n    \"alt\": \"simple-column-and-measure-roles.png\",\n    \"title\": \"Adding a column and an implicit measure to the data roles.\"\n  })), mdx(\"p\", null, \"After doing this, Power BI will generate the following query against the data model (which can be verified using the \", mdx(OutboundLink, {\n    href: \"https://docs.microsoft.com/en-us/power-bi/create-reports/desktop-performance-analyzer?WT.mc_id=DP-MVP-5003712\",\n    target: \"_blank\",\n    mdxType: \"OutboundLink\"\n  }, \"Performance Analyzer\"), \"):\"), mdx(\"pre\", null, mdx(\"code\", {\n    parentName: \"pre\",\n    \"className\": \"language-dax\"\n  }, \"// DAX Query\\nDEFINE\\n    VAR __DS0Core =\\n        SUMMARIZECOLUMNS (\\n            'financials'[Country],\\n            \\\"Sumv_Sales\\\", CALCULATE ( SUM ( 'financials'[ Sales] ) )\\n        )\\n    VAR __DS0PrimaryWindowed =\\n        TOPN ( 10001, __DS0Core, 'financials'[Country], 1 )\\nEVALUATE\\n__DS0PrimaryWindowed\\nORDER BY 'financials'[Country]\\n\")), mdx(\"p\", null, \"This would produce the following dataset (visualized using a table):\"), mdx(\"p\", null, mdx(\"img\", {\n    parentName: \"p\",\n    \"src\": \"/images/interactivity/simple-column-and-measure-result.png\",\n    \"alt\": \"simple-column-and-measure-result.png\",\n    \"title\": \"Results of a simple DAX query (using a table visual).\"\n  })), mdx(\"p\", null, \"...and this dataset is supplied by Power BI into the visual. At this point, Deneb's logic will process the dataset and things continue as normal.\"), mdx(\"blockquote\", null, mdx(\"p\", {\n    parentName: \"blockquote\"\n  }, mdx(\"em\", {\n    parentName: \"p\"\n  }, \"Refer to the \", mdx(\"a\", {\n    parentName: \"em\",\n    \"href\": \"visual-dataset-binding#grain--row-context\"\n  }, \"Visual Dataset Binding\"), \" page if you want to see how this data would get represented internally.\"))), mdx(\"h3\", {\n    \"id\": \"signaling-back-to-power-bi\",\n    \"style\": {\n      \"position\": \"relative\"\n    }\n  }, mdx(\"a\", {\n    parentName: \"h3\",\n    \"href\": \"#signaling-back-to-power-bi\",\n    \"aria-label\": \"signaling back to power bi permalink\",\n    \"className\": \"anchor before\"\n  }, mdx(\"svg\", {\n    parentName: \"a\",\n    \"aria-hidden\": \"true\",\n    \"focusable\": \"false\",\n    \"height\": \"16\",\n    \"version\": \"1.1\",\n    \"viewBox\": \"0 0 16 16\",\n    \"width\": \"16\"\n  }, mdx(\"path\", {\n    parentName: \"svg\",\n    \"fillRule\": \"evenodd\",\n    \"d\": \"M4 9h1v1H4c-1.5 0-3-1.69-3-3.5S2.55 3 4 3h4c1.45 0 3 1.69 3 3.5 0 1.41-.91 2.72-2 3.25V8.59c.58-.45 1-1.27 1-2.09C10 5.22 8.98 4 8 4H4c-.98 0-2 1.22-2 2.5S3 9 4 9zm9-3h-1v1h1c1 0 2 1.22 2 2.5S13.98 12 13 12H9c-.98 0-2-1.22-2-2.5 0-.83.42-1.64 1-2.09V6.25c-1.09.53-2 1.84-2 3.25C6 11.31 7.55 13 9 13h4c1.45 0 3-1.69 3-3.5S14.5 6 13 6z\"\n  }))), \"Signaling Back to Power BI\"), mdx(\"p\", null, \"Now using the above as an example, we can talk about the following interactivity scenarios:\"), mdx(\"ul\", null, mdx(\"li\", {\n    parentName: \"ul\"\n  }, \"Cross-filtering other visuals\"), mdx(\"li\", {\n    parentName: \"ul\"\n  }, \"Drilling-through from the context menu\"), mdx(\"li\", {\n    parentName: \"ul\"\n  }, \"Displaying a report page tooltip or leveraging modern tooltip features\")), mdx(\"p\", null, \"All of these situations require the visual to tell Power BI what data it needs to work with... but here's the thing: just like how visuals can't just read whatever they like from the data model, they \", mdx(\"em\", {\n    parentName: \"p\"\n  }, \"definitely\"), \" can't send anything back.\"), mdx(\"p\", null, \"For these situations, Power BI provides APIs for a visual to request that Power BI try to do these things on its behalf. For Power BI to fulfil this, it needs to know which row(s) from the orginal dataset it has to resolve.\"), mdx(\"ul\", null, mdx(\"li\", {\n    parentName: \"ul\"\n  }, mdx(\"p\", {\n    parentName: \"li\"\n  }, \"If you have just taken the dataset as-is and created a mark using Vega or Vega-Lite, then a mark's datum still has the correct row context and identifying information that Power BI needs.\")), mdx(\"li\", {\n    parentName: \"ul\"\n  }, mdx(\"p\", {\n    parentName: \"li\"\n  }, \"However, if you apply an operation in your specification that mutates the data from its original dataset - for example a transform (\", mdx(OutboundLink, {\n    href: \"https://vega.github.io/vega/docs/transforms/\",\n    target: \"_blank\",\n    mdxType: \"OutboundLink\"\n  }, \"Vega\"), \" | \", mdx(OutboundLink, {\n    href: \"https://vega.github.io/vega-lite/docs/transform.html\",\n    target: \"_blank\",\n    mdxType: \"OutboundLink\"\n  }, \" Vega-Lite\"), \") - then we lose the ability to leverage this functionality in the resulting outputs.\"))), mdx(\"p\", null, \"Any functionality we can deliver needs to bear these constraints in mind.\"), mdx(\"h4\", {\n    \"id\": \"additional-datum-fields\",\n    \"style\": {\n      \"position\": \"relative\"\n    }\n  }, mdx(\"a\", {\n    parentName: \"h4\",\n    \"href\": \"#additional-datum-fields\",\n    \"aria-label\": \"additional datum fields permalink\",\n    \"className\": \"anchor before\"\n  }, mdx(\"svg\", {\n    parentName: \"a\",\n    \"aria-hidden\": \"true\",\n    \"focusable\": \"false\",\n    \"height\": \"16\",\n    \"version\": \"1.1\",\n    \"viewBox\": \"0 0 16 16\",\n    \"width\": \"16\"\n  }, mdx(\"path\", {\n    parentName: \"svg\",\n    \"fillRule\": \"evenodd\",\n    \"d\": \"M4 9h1v1H4c-1.5 0-3-1.69-3-3.5S2.55 3 4 3h4c1.45 0 3 1.69 3 3.5 0 1.41-.91 2.72-2 3.25V8.59c.58-.45 1-1.27 1-2.09C10 5.22 8.98 4 8 4H4c-.98 0-2 1.22-2 2.5S3 9 4 9zm9-3h-1v1h1c1 0 2 1.22 2 2.5S13.98 12 13 12H9c-.98 0-2-1.22-2-2.5 0-.83.42-1.64 1-2.09V6.25c-1.09.53-2 1.84-2 3.25C6 11.31 7.55 13 9 13h4c1.45 0 3-1.69 3-3.5S14.5 6 13 6z\"\n  }))), \"Additional Datum Fields\"), mdx(\"p\", null, \"Provided that there are no such mutations, a Vega or Vega-Lite datum will contain the following additional fields for reconcilitation purposes:\"), mdx(\"ul\", null, mdx(\"li\", {\n    parentName: \"ul\"\n  }, mdx(\"p\", {\n    parentName: \"li\"\n  }, mdx(\"inlineCode\", {\n    parentName: \"p\"\n  }, \"__identity__\"), \" - this is the raw identity and true row context.\"), mdx(\"ul\", {\n    parentName: \"li\"\n  }, mdx(\"li\", {\n    parentName: \"ul\"\n  }, \"For those familiar with Power BI visuals development, it is a \", mdx(OutboundLink, {\n    href: \"https://docs.microsoft.com/en-us/power-bi/developer/visuals/selection-api\",\n    target: \"_blank\",\n    mdxType: \"OutboundLink\"\n  }, mdx(\"inlineCode\", {\n    parentName: \"li\"\n  }, \"SelectionId\")), \", which can be passed to Power BI's Selection Manager for \", mdx(\"a\", {\n    parentName: \"li\",\n    \"href\": \"/interactivity-features-overview/#signaling-back-to-power-bi\"\n  }, \"delegation\"), \".\"), mdx(\"li\", {\n    parentName: \"ul\"\n  }, \"This is a complex JavaScript object and therefore not something we can use in Vega directly. Complex objects are not comparable in the same way, say, text values are, so this should not be used for anything in your spec.\"))), mdx(\"li\", {\n    parentName: \"ul\"\n  }, mdx(\"p\", {\n    parentName: \"li\"\n  }, mdx(\"inlineCode\", {\n    parentName: \"p\"\n  }, \"__key__\"), \" - this is a representation of the \", mdx(\"inlineCode\", {\n    parentName: \"p\"\n  }, \"__identity__\"), \" object that can be used inside a spec, as it has been suitably processed.\")), mdx(\"li\", {\n    parentName: \"ul\"\n  }, mdx(\"p\", {\n    parentName: \"li\"\n  }, mdx(\"inlineCode\", {\n    parentName: \"p\"\n  }, \"identityIndex\"), \" - this is the (zero-based) index of the visual dataset's corresponding entry.\")), mdx(\"li\", {\n    parentName: \"ul\"\n  }, mdx(\"p\", {\n    parentName: \"li\"\n  }, mdx(\"inlineCode\", {\n    parentName: \"p\"\n  }, \"__selected__\"), \" - whether this particular row context is selected for \", mdx(\"a\", {\n    parentName: \"p\",\n    \"href\": \"/interactivity-selection\"\n  }, \"cross-filtering\"), \".\"))), mdx(\"p\", null, \"These may become visible to you when \", mdx(\"a\", {\n    parentName: \"p\",\n    \"href\": \"/interactivity-tooltips#debugging-with-tooltips\"\n  }, \"inspecting a datum using tooltips\"), \" or similar, but they aren't currently supported for use outside of anything Deneb does for you.\"), mdx(\"h3\", {\n    \"id\": \"what-about\",\n    \"style\": {\n      \"position\": \"relative\"\n    }\n  }, mdx(\"a\", {\n    parentName: \"h3\",\n    \"href\": \"#what-about\",\n    \"aria-label\": \"what about permalink\",\n    \"className\": \"anchor before\"\n  }, mdx(\"svg\", {\n    parentName: \"a\",\n    \"aria-hidden\": \"true\",\n    \"focusable\": \"false\",\n    \"height\": \"16\",\n    \"version\": \"1.1\",\n    \"viewBox\": \"0 0 16 16\",\n    \"width\": \"16\"\n  }, mdx(\"path\", {\n    parentName: \"svg\",\n    \"fillRule\": \"evenodd\",\n    \"d\": \"M4 9h1v1H4c-1.5 0-3-1.69-3-3.5S2.55 3 4 3h4c1.45 0 3 1.69 3 3.5 0 1.41-.91 2.72-2 3.25V8.59c.58-.45 1-1.27 1-2.09C10 5.22 8.98 4 8 4H4c-.98 0-2 1.22-2 2.5S3 9 4 9zm9-3h-1v1h1c1 0 2 1.22 2 2.5S13.98 12 13 12H9c-.98 0-2-1.22-2-2.5 0-.83.42-1.64 1-2.09V6.25c-1.09.53-2 1.84-2 3.25C6 11.31 7.55 13 9 13h4c1.45 0 3-1.69 3-3.5S14.5 6 13 6z\"\n  }))), \"What About..?\"), mdx(\"p\", null, \"There's a couple of interactivity scenarios we've missed out from above:\"), mdx(\"ul\", null, mdx(\"li\", {\n    parentName: \"ul\"\n  }, \"Default tooltips are different to report page or modern tooltips.\", mdx(\"ul\", {\n    parentName: \"li\"\n  }, mdx(\"li\", {\n    parentName: \"ul\"\n  }, \"In these cases Deneb can pass a list of values to display and ask Power BI to display them inside a standard tooltip.\"), mdx(\"li\", {\n    parentName: \"ul\"\n  }, \"This is also the fall-back behavior if the row context cannot be resolved by Power BI, or a suitable tooltip page cannot be found.\"), mdx(\"li\", {\n    parentName: \"ul\"\n  }, \"Tooltip functionality within Deneb is covered in much more detail on the \", mdx(\"a\", {\n    parentName: \"li\",\n    \"href\": \"interactivity-tooltips\"\n  }, \"Tooltips\"), \" page.\"))), mdx(\"li\", {\n    parentName: \"ul\"\n  }, \"Slicer filtering works differently to cross-filtering, but as Deneb is not a slicer, we're skipping that one.\")), mdx(\"h2\", {\n    \"id\": \"visual-effects-and-behavior\",\n    \"style\": {\n      \"position\": \"relative\"\n    }\n  }, mdx(\"a\", {\n    parentName: \"h2\",\n    \"href\": \"#visual-effects-and-behavior\",\n    \"aria-label\": \"visual effects and behavior permalink\",\n    \"className\": \"anchor before\"\n  }, mdx(\"svg\", {\n    parentName: \"a\",\n    \"aria-hidden\": \"true\",\n    \"focusable\": \"false\",\n    \"height\": \"16\",\n    \"version\": \"1.1\",\n    \"viewBox\": \"0 0 16 16\",\n    \"width\": \"16\"\n  }, mdx(\"path\", {\n    parentName: \"svg\",\n    \"fillRule\": \"evenodd\",\n    \"d\": \"M4 9h1v1H4c-1.5 0-3-1.69-3-3.5S2.55 3 4 3h4c1.45 0 3 1.69 3 3.5 0 1.41-.91 2.72-2 3.25V8.59c.58-.45 1-1.27 1-2.09C10 5.22 8.98 4 8 4H4c-.98 0-2 1.22-2 2.5S3 9 4 9zm9-3h-1v1h1c1 0 2 1.22 2 2.5S13.98 12 13 12H9c-.98 0-2-1.22-2-2.5 0-.83.42-1.64 1-2.09V6.25c-1.09.53-2 1.84-2 3.25C6 11.31 7.55 13 9 13h4c1.45 0 3-1.69 3-3.5S14.5 6 13 6z\"\n  }))), \"Visual Effects and Behavior\"), mdx(\"p\", null, \"Whilst this section is not as large as the above one, it is still very important to consider.\"), mdx(\"p\", null, \"In defining a specification, you have control over how Vega or Vega-Lite renders the output for interaction events. You may choose to employ dimming or opacity-based effects for non-selected marks, or you may choose to alter their color, or try something completely unique and original. You can read more about how to start working with these approaches on the \", mdx(\"a\", {\n    parentName: \"p\",\n    \"href\": \"/interactivity-selection\"\n  }, \"Cross-Filtering\"), \" page.\"));\n}\n;\nMDXContent.isMDXComponent = true;","headings":[{"depth":2,"value":"How Deneb Can Be Different from R & Python Options"},{"depth":2,"value":"Managing your Expectations"},{"depth":2,"value":"Reconciliation of Data and/or Row Context"},{"depth":3,"value":"Getting Data from the Model"},{"depth":3,"value":"Signaling Back to Power BI"},{"depth":4,"value":"Additional Datum Fields"},{"depth":3,"value":"What About..?"},{"depth":2,"value":"Visual Effects and Behavior"}]}},"pageContext":{"slug":"/interactivity-features-overview/","prev":{"label":"Performance Considerations","link":"/performance-considerations"},"next":{"label":"Tooltips","link":"/interactivity-tooltips"},"repositoryEditUrl":"https://github.com/deneb-viz/deneb-viz.github.io/tree/source/src/docs/interactivity-features-overview.mdx","repositoryProvider":"GitHub"}},
    "staticQueryHashes": ["1954253342","2328931024","2501019404","973074209"]}