{
    "componentChunkName": "component---node-modules-rocketseat-gatsby-theme-docs-core-src-templates-docs-query-js",
    "path": "/simple-worked-example",
    "result": {"data":{"mdx":{"id":"3fe436d1-86b2-5c06-b44c-29859f893700","excerpt":"In the following pages, we'll create a simple bar chart, using the visual, some data, an inbuilt template and  Vega-Lite . For reference, here's the finishedâ€¦","fields":{"slug":"/simple-worked-example/"},"frontmatter":{"title":"Creating from a Template (or: Let's Make A Vega-Lite Bar Chart)","description":"How to add a new visual to your report.","image":"/images/favicon.png","disableTableOfContents":false},"body":"var _excluded = [\"components\"];\n\nfunction _extends() { _extends = Object.assign || function (target) { for (var i = 1; i < arguments.length; i++) { var source = arguments[i]; for (var key in source) { if (Object.prototype.hasOwnProperty.call(source, key)) { target[key] = source[key]; } } } return target; }; return _extends.apply(this, arguments); }\n\nfunction _objectWithoutProperties(source, excluded) { if (source == null) return {}; var target = _objectWithoutPropertiesLoose(source, excluded); var key, i; if (Object.getOwnPropertySymbols) { var sourceSymbolKeys = Object.getOwnPropertySymbols(source); for (i = 0; i < sourceSymbolKeys.length; i++) { key = sourceSymbolKeys[i]; if (excluded.indexOf(key) >= 0) continue; if (!Object.prototype.propertyIsEnumerable.call(source, key)) continue; target[key] = source[key]; } } return target; }\n\nfunction _objectWithoutPropertiesLoose(source, excluded) { if (source == null) return {}; var target = {}; var sourceKeys = Object.keys(source); var key, i; for (i = 0; i < sourceKeys.length; i++) { key = sourceKeys[i]; if (excluded.indexOf(key) >= 0) continue; target[key] = source[key]; } return target; }\n\n/* @jsxRuntime classic */\n\n/* @jsx mdx */\nvar _frontmatter = {\n  \"title\": \"Creating from a Template (or: Let's Make A Vega-Lite Bar Chart)\",\n  \"description\": \"How to add a new visual to your report.\",\n  \"image\": \"/images/favicon.png\",\n  \"disableTableOfContents\": false\n};\nvar layoutProps = {\n  _frontmatter: _frontmatter\n};\nvar MDXLayout = \"wrapper\";\nreturn function MDXContent(_ref) {\n  var components = _ref.components,\n      props = _objectWithoutProperties(_ref, _excluded);\n\n  return mdx(MDXLayout, _extends({}, layoutProps, props, {\n    components: components,\n    mdxType: \"MDXLayout\"\n  }), mdx(\"p\", null, \"In the following pages, we'll create a simple bar chart, using the visual, some data, an inbuilt template and \", mdx(OutboundLink, {\n    href: \"http://vega.github.io/vega-lite\",\n    target: \"_blank\",\n    mdxType: \"OutboundLink\"\n  }, \"Vega-Lite\"), \". For reference, here's the finished product:\"), mdx(\"div\", {\n    \"className\": \"gatsby-resp-iframe-wrapper\",\n    \"style\": {\n      \"paddingBottom\": \"60.75000000000001%\",\n      \"position\": \"relative\",\n      \"height\": \"0\",\n      \"overflow\": \"hidden\"\n    }\n  }, \" \", mdx(\"iframe\", {\n    parentName: \"div\",\n    \"src\": \"https://app.powerbi.com/view?r=eyJrIjoiYTcyMDJkZDEtODc0Yy00MDc2LWJiNDAtY2UxODhjZTU2NDBjIiwidCI6IjUzYmJlMGQ3LTU0NzItNGQ0NS04NGY0LWJiNzJiYjFjMjI4OSJ9&pageName=ReportSectionc2e9778dd899bccd64ca\",\n    \"frameBorder\": \"0\",\n    \"allowFullScreen\": \"true\",\n    \"style\": {\n      \"position\": \"absolute\",\n      \"top\": \"0\",\n      \"left\": \"0\",\n      \"width\": \"100%\",\n      \"height\": \"100%\"\n    }\n  }), \" \"), mdx(\"p\", null, \"\\xA0\", \"\\xA0\", \"\\xA0\", \"\\xA0\", mdx(\"em\", {\n    parentName: \"p\"\n  }, mdx(\"a\", {\n    parentName: \"em\",\n    \"href\": \"/pbix/Deneb%20-%20Simple%20Vega-Lite%20Bar%20Chart%20Example.pbix\"\n  }, \"Download this workbook\"))), mdx(\"h2\", {\n    \"id\": \"sample-data\",\n    \"style\": {\n      \"position\": \"relative\"\n    }\n  }, mdx(\"a\", {\n    parentName: \"h2\",\n    \"href\": \"#sample-data\",\n    \"aria-label\": \"sample data permalink\",\n    \"className\": \"anchor before\"\n  }, mdx(\"svg\", {\n    parentName: \"a\",\n    \"aria-hidden\": \"true\",\n    \"focusable\": \"false\",\n    \"height\": \"16\",\n    \"version\": \"1.1\",\n    \"viewBox\": \"0 0 16 16\",\n    \"width\": \"16\"\n  }, mdx(\"path\", {\n    parentName: \"svg\",\n    \"fillRule\": \"evenodd\",\n    \"d\": \"M4 9h1v1H4c-1.5 0-3-1.69-3-3.5S2.55 3 4 3h4c1.45 0 3 1.69 3 3.5 0 1.41-.91 2.72-2 3.25V8.59c.58-.45 1-1.27 1-2.09C10 5.22 8.98 4 8 4H4c-.98 0-2 1.22-2 2.5S3 9 4 9zm9-3h-1v1h1c1 0 2 1.22 2 2.5S13.98 12 13 12H9c-.98 0-2-1.22-2-2.5 0-.83.42-1.64 1-2.09V6.25c-1.09.53-2 1.84-2 3.25C6 11.31 7.55 13 9 13h4c1.45 0 3-1.69 3-3.5S14.5 6 13 6z\"\n  }))), \"Sample Data\"), mdx(\"p\", null, \"From the sample workbook, we'll use a single column and measure. Here's how they look as a table:\"), mdx(\"p\", null, mdx(\"img\", {\n    parentName: \"p\",\n    \"src\": \"/images/getting-started/simple-data-table.png\",\n    \"alt\": \"simple-data-table.png\",\n    \"title\": \"A simple category column (City) and measure (Mean Temperature).\"\n  })), mdx(\"p\", null, \"Here, the \", mdx(\"inlineCode\", {\n    parentName: \"p\"\n  }, \"[City]\"), \" column represents a nominal category, and \", mdx(\"inlineCode\", {\n    parentName: \"p\"\n  }, \"[Mean Temperature]\"), \" is a simple measure that calculates the average temperature value for the given row context.\"), mdx(\"h2\", {\n    \"id\": \"adding-the-visual\",\n    \"style\": {\n      \"position\": \"relative\"\n    }\n  }, mdx(\"a\", {\n    parentName: \"h2\",\n    \"href\": \"#adding-the-visual\",\n    \"aria-label\": \"adding the visual permalink\",\n    \"className\": \"anchor before\"\n  }, mdx(\"svg\", {\n    parentName: \"a\",\n    \"aria-hidden\": \"true\",\n    \"focusable\": \"false\",\n    \"height\": \"16\",\n    \"version\": \"1.1\",\n    \"viewBox\": \"0 0 16 16\",\n    \"width\": \"16\"\n  }, mdx(\"path\", {\n    parentName: \"svg\",\n    \"fillRule\": \"evenodd\",\n    \"d\": \"M4 9h1v1H4c-1.5 0-3-1.69-3-3.5S2.55 3 4 3h4c1.45 0 3 1.69 3 3.5 0 1.41-.91 2.72-2 3.25V8.59c.58-.45 1-1.27 1-2.09C10 5.22 8.98 4 8 4H4c-.98 0-2 1.22-2 2.5S3 9 4 9zm9-3h-1v1h1c1 0 2 1.22 2 2.5S13.98 12 13 12H9c-.98 0-2-1.22-2-2.5 0-.83.42-1.64 1-2.09V6.25c-1.09.53-2 1.84-2 3.25C6 11.31 7.55 13 9 13h4c1.45 0 3-1.69 3-3.5S14.5 6 13 6z\"\n  }))), \"Adding the Visual\"), mdx(\"p\", null, \"If you've added the visual to your report, you should see it in the \", mdx(\"em\", {\n    parentName: \"p\"\n  }, \"Visualizations\"), \" pane, eg.:\"), mdx(\"p\", null, mdx(\"img\", {\n    parentName: \"p\",\n    \"src\": \"/images/getting-started/viz-added.png\",\n    \"alt\": \"viz-added.png\",\n    \"title\": \"The visual gets added to the 'Visualizations' pane in your report.\"\n  })), mdx(\"p\", null, \"You can then click the visual to add it to the report canvas, e.g.:\"), mdx(\"p\", null, mdx(\"img\", {\n    parentName: \"p\",\n    \"src\": \"/images/getting-started/viz-landing.png\",\n    \"alt\": \"viz-landing.png\",\n    \"title\": \"The visual landing page.\"\n  })), mdx(\"h2\", {\n    \"id\": \"adding-the-data\",\n    \"style\": {\n      \"position\": \"relative\"\n    }\n  }, mdx(\"a\", {\n    parentName: \"h2\",\n    \"href\": \"#adding-the-data\",\n    \"aria-label\": \"adding the data permalink\",\n    \"className\": \"anchor before\"\n  }, mdx(\"svg\", {\n    parentName: \"a\",\n    \"aria-hidden\": \"true\",\n    \"focusable\": \"false\",\n    \"height\": \"16\",\n    \"version\": \"1.1\",\n    \"viewBox\": \"0 0 16 16\",\n    \"width\": \"16\"\n  }, mdx(\"path\", {\n    parentName: \"svg\",\n    \"fillRule\": \"evenodd\",\n    \"d\": \"M4 9h1v1H4c-1.5 0-3-1.69-3-3.5S2.55 3 4 3h4c1.45 0 3 1.69 3 3.5 0 1.41-.91 2.72-2 3.25V8.59c.58-.45 1-1.27 1-2.09C10 5.22 8.98 4 8 4H4c-.98 0-2 1.22-2 2.5S3 9 4 9zm9-3h-1v1h1c1 0 2 1.22 2 2.5S13.98 12 13 12H9c-.98 0-2-1.22-2-2.5 0-.83.42-1.64 1-2.09V6.25c-1.09.53-2 1.84-2 3.25C6 11.31 7.55 13 9 13h4c1.45 0 3-1.69 3-3.5S14.5 6 13 6z\"\n  }))), \"Adding the Data\"), mdx(\"p\", null, \"We'll now add the \", mdx(\"inlineCode\", {\n    parentName: \"p\"\n  }, \"[City]\"), \" column and \", mdx(\"inlineCode\", {\n    parentName: \"p\"\n  }, \"[Mean Temperature]\"), \" measure to Deneb's \", mdx(\"strong\", {\n    parentName: \"p\"\n  }, \"Values\"), \" data role, e.g.:\"), mdx(\"p\", null, mdx(\"img\", {\n    parentName: \"p\",\n    \"src\": \"/images/getting-started/viz-needs-spec.png\",\n    \"alt\": \"viz-needs-spec.png\",\n    \"title\": \"The visual now indicates that a specification is required.\"\n  })), mdx(\"p\", null, \"The visual's output now changes to indicate that a specification is required. This is required to tell Vega-Lite (or Vega) how your visualization should be rendered.\"), mdx(\"h2\", {\n    \"id\": \"opening-the-editor\",\n    \"style\": {\n      \"position\": \"relative\"\n    }\n  }, mdx(\"a\", {\n    parentName: \"h2\",\n    \"href\": \"#opening-the-editor\",\n    \"aria-label\": \"opening the editor permalink\",\n    \"className\": \"anchor before\"\n  }, mdx(\"svg\", {\n    parentName: \"a\",\n    \"aria-hidden\": \"true\",\n    \"focusable\": \"false\",\n    \"height\": \"16\",\n    \"version\": \"1.1\",\n    \"viewBox\": \"0 0 16 16\",\n    \"width\": \"16\"\n  }, mdx(\"path\", {\n    parentName: \"svg\",\n    \"fillRule\": \"evenodd\",\n    \"d\": \"M4 9h1v1H4c-1.5 0-3-1.69-3-3.5S2.55 3 4 3h4c1.45 0 3 1.69 3 3.5 0 1.41-.91 2.72-2 3.25V8.59c.58-.45 1-1.27 1-2.09C10 5.22 8.98 4 8 4H4c-.98 0-2 1.22-2 2.5S3 9 4 9zm9-3h-1v1h1c1 0 2 1.22 2 2.5S13.98 12 13 12H9c-.98 0-2-1.22-2-2.5 0-.83.42-1.64 1-2.09V6.25c-1.09.53-2 1.84-2 3.25C6 11.31 7.55 13 9 13h4c1.45 0 3-1.69 3-3.5S14.5 6 13 6z\"\n  }))), \"Opening the Editor\"), mdx(\"p\", null, \"We can now open the Visual Editor by selecting the visual header (...) and then \", mdx(\"em\", {\n    parentName: \"p\"\n  }, \"Edit\"), \", e.g.:\"), mdx(\"p\", null, mdx(\"img\", {\n    parentName: \"p\",\n    \"src\": \"/images/getting-started/opening-editor.png\",\n    \"alt\": \"opening-editor.png\",\n    \"title\": \"We can access the Visual Editor by selecting 'Edit' from the Visual Header.\"\n  })), mdx(\"p\", null, \"This will display the Visual Editor in focus mode, and the \", mdx(\"em\", {\n    parentName: \"p\"\n  }, \"Create New Specification\"), \" dialog will be shown, e.g.:\"), mdx(\"p\", null, mdx(\"img\", {\n    parentName: \"p\",\n    \"src\": \"/images/getting-started/create-new-spec.png\",\n    \"alt\": \"create-new-spec.png\",\n    \"title\": \"The Visual Editor, showing the 'Create New Specification' dialog.\"\n  })), mdx(\"blockquote\", null, mdx(\"p\", {\n    parentName: \"blockquote\"\n  }, mdx(\"em\", {\n    parentName: \"p\"\n  }, \"If you accidentally dismiss the dialog, or it doesn't show, you can bring it up by clicking on the \", mdx(\"strong\", {\n    parentName: \"em\"\n  }, \"New Specification\"), \" button on the command bar, or using \", mdx(\"strong\", {\n    parentName: \"em\"\n  }, \"[Ctrl + Alt + N]\")))), mdx(\"h2\", {\n    \"id\": \"selecting-the-template\",\n    \"style\": {\n      \"position\": \"relative\"\n    }\n  }, mdx(\"a\", {\n    parentName: \"h2\",\n    \"href\": \"#selecting-the-template\",\n    \"aria-label\": \"selecting the template permalink\",\n    \"className\": \"anchor before\"\n  }, mdx(\"svg\", {\n    parentName: \"a\",\n    \"aria-hidden\": \"true\",\n    \"focusable\": \"false\",\n    \"height\": \"16\",\n    \"version\": \"1.1\",\n    \"viewBox\": \"0 0 16 16\",\n    \"width\": \"16\"\n  }, mdx(\"path\", {\n    parentName: \"svg\",\n    \"fillRule\": \"evenodd\",\n    \"d\": \"M4 9h1v1H4c-1.5 0-3-1.69-3-3.5S2.55 3 4 3h4c1.45 0 3 1.69 3 3.5 0 1.41-.91 2.72-2 3.25V8.59c.58-.45 1-1.27 1-2.09C10 5.22 8.98 4 8 4H4c-.98 0-2 1.22-2 2.5S3 9 4 9zm9-3h-1v1h1c1 0 2 1.22 2 2.5S13.98 12 13 12H9c-.98 0-2-1.22-2-2.5 0-.83.42-1.64 1-2.09V6.25c-1.09.53-2 1.84-2 3.25C6 11.31 7.55 13 9 13h4c1.45 0 3-1.69 3-3.5S14.5 6 13 6z\"\n  }))), \"Selecting the Template\"), mdx(\"p\", null, \"Using Vega or Vega-Lite requires a specification to be written using JSON. You can either select the \", mdx(\"em\", {\n    parentName: \"p\"\n  }, \"[empty]\"), \" template to begin editing with a bare-minimum specification with the dataset bound to it, or use a predefined template.\"), mdx(\"p\", null, \"Let's choose the \", mdx(\"strong\", {\n    parentName: \"p\"\n  }, \"Simple Bar Chart\"), \" template by clicking on it. Note that we now get some additional details about the template, as well as some required placeholders:\"), mdx(\"p\", null, mdx(\"img\", {\n    parentName: \"p\",\n    \"src\": \"/images/getting-started/bar-chart-template-initial.png\",\n    \"alt\": \"bar-chart-template-initial.png\",\n    \"title\": \"Selecting a template will provide any other options required to prepare it.\"\n  })), mdx(\"h2\", {\n    \"id\": \"assigning-placeholders\",\n    \"style\": {\n      \"position\": \"relative\"\n    }\n  }, mdx(\"a\", {\n    parentName: \"h2\",\n    \"href\": \"#assigning-placeholders\",\n    \"aria-label\": \"assigning placeholders permalink\",\n    \"className\": \"anchor before\"\n  }, mdx(\"svg\", {\n    parentName: \"a\",\n    \"aria-hidden\": \"true\",\n    \"focusable\": \"false\",\n    \"height\": \"16\",\n    \"version\": \"1.1\",\n    \"viewBox\": \"0 0 16 16\",\n    \"width\": \"16\"\n  }, mdx(\"path\", {\n    parentName: \"svg\",\n    \"fillRule\": \"evenodd\",\n    \"d\": \"M4 9h1v1H4c-1.5 0-3-1.69-3-3.5S2.55 3 4 3h4c1.45 0 3 1.69 3 3.5 0 1.41-.91 2.72-2 3.25V8.59c.58-.45 1-1.27 1-2.09C10 5.22 8.98 4 8 4H4c-.98 0-2 1.22-2 2.5S3 9 4 9zm9-3h-1v1h1c1 0 2 1.22 2 2.5S13.98 12 13 12H9c-.98 0-2-1.22-2-2.5 0-.83.42-1.64 1-2.09V6.25c-1.09.53-2 1.84-2 3.25C6 11.31 7.55 13 9 13h4c1.45 0 3-1.69 3-3.5S14.5 6 13 6z\"\n  }))), \"Assigning Placeholders\"), mdx(\"p\", null, \"This template expects two placeholders: one for the the category axis and another for the measure axis. As we've already added our data, we can see these are already available in the dropdown lists, e.g.:\"), mdx(\"p\", null, mdx(\"img\", {\n    parentName: \"p\",\n    \"src\": \"/images/getting-started/category-placeholder.png\",\n    \"alt\": \"category-placeholder.png\",\n    \"title\": \"A placeholder displays columns or measures you've added to the visual.\"\n  })), mdx(\"p\", null, \"Note that \", mdx(\"em\", {\n    parentName: \"p\"\n  }, \"Mean Temperature\"), \" is disabled. This is because the placeholder specifies a column be added here. We'll choose \", mdx(\"em\", {\n    parentName: \"p\"\n  }, \"City\"), \".\"), mdx(\"blockquote\", null, mdx(\"p\", {\n    parentName: \"blockquote\"\n  }, mdx(\"em\", {\n    parentName: \"p\"\n  }, \"The visual only knows about columns or measures added to it, so you can add or swap out a column or measure if it's not the one you want and the dropdown list will update accordingly.\"))), mdx(\"p\", null, \"Next, we'll click on the \", mdx(\"em\", {\n    parentName: \"p\"\n  }, \"Measure\"), \" placeholder:\"), mdx(\"p\", null, mdx(\"img\", {\n    parentName: \"p\",\n    \"src\": \"/images/getting-started/measure-placeholder.png\",\n    \"alt\": \"measure-placeholder.png\",\n    \"title\": \"A placeholder displays columns or measures you've added to the visual.\"\n  })), mdx(\"p\", null, \"Similarly, as this placeholder specifies a measure, notice that \", mdx(\"em\", {\n    parentName: \"p\"\n  }, \"City\"), \" is disabled here. We'll choose \", mdx(\"em\", {\n    parentName: \"p\"\n  }, \"Mean Temperature\"), \" to complete our requirements.\"), mdx(\"h2\", {\n    \"id\": \"creating-the-initial-specification\",\n    \"style\": {\n      \"position\": \"relative\"\n    }\n  }, mdx(\"a\", {\n    parentName: \"h2\",\n    \"href\": \"#creating-the-initial-specification\",\n    \"aria-label\": \"creating the initial specification permalink\",\n    \"className\": \"anchor before\"\n  }, mdx(\"svg\", {\n    parentName: \"a\",\n    \"aria-hidden\": \"true\",\n    \"focusable\": \"false\",\n    \"height\": \"16\",\n    \"version\": \"1.1\",\n    \"viewBox\": \"0 0 16 16\",\n    \"width\": \"16\"\n  }, mdx(\"path\", {\n    parentName: \"svg\",\n    \"fillRule\": \"evenodd\",\n    \"d\": \"M4 9h1v1H4c-1.5 0-3-1.69-3-3.5S2.55 3 4 3h4c1.45 0 3 1.69 3 3.5 0 1.41-.91 2.72-2 3.25V8.59c.58-.45 1-1.27 1-2.09C10 5.22 8.98 4 8 4H4c-.98 0-2 1.22-2 2.5S3 9 4 9zm9-3h-1v1h1c1 0 2 1.22 2 2.5S13.98 12 13 12H9c-.98 0-2-1.22-2-2.5 0-.83.42-1.64 1-2.09V6.25c-1.09.53-2 1.84-2 3.25C6 11.31 7.55 13 9 13h4c1.45 0 3-1.69 3-3.5S14.5 6 13 6z\"\n  }))), \"Creating the Initial Specification\"), mdx(\"p\", null, \"Now that all placeholders have been filled, the \", mdx(\"em\", {\n    parentName: \"p\"\n  }, \"Create\"), \" button is enabled:\"), mdx(\"p\", null, mdx(\"img\", {\n    parentName: \"p\",\n    \"src\": \"/images/getting-started/create-button-enabled.png\",\n    \"alt\": \"create-button-enabled.png\",\n    \"title\": \"Once all placeholders have been assigned, the 'Create' button is enabled.\"\n  })), mdx(\"p\", null, \"We can click this and the visual specification will be present in the editor, e.g.:\"), mdx(\"p\", null, mdx(\"img\", {\n    parentName: \"p\",\n    \"src\": \"/images/getting-started/created-from-template.png\",\n    \"alt\": \"created-from-template.png\",\n    \"title\": \"After clicking on 'Create' the editor now shows the specification and the rendered visual.\"\n  })), mdx(\"h2\", {\n    \"id\": \"reviewing-generated-specification\",\n    \"style\": {\n      \"position\": \"relative\"\n    }\n  }, mdx(\"a\", {\n    parentName: \"h2\",\n    \"href\": \"#reviewing-generated-specification\",\n    \"aria-label\": \"reviewing generated specification permalink\",\n    \"className\": \"anchor before\"\n  }, mdx(\"svg\", {\n    parentName: \"a\",\n    \"aria-hidden\": \"true\",\n    \"focusable\": \"false\",\n    \"height\": \"16\",\n    \"version\": \"1.1\",\n    \"viewBox\": \"0 0 16 16\",\n    \"width\": \"16\"\n  }, mdx(\"path\", {\n    parentName: \"svg\",\n    \"fillRule\": \"evenodd\",\n    \"d\": \"M4 9h1v1H4c-1.5 0-3-1.69-3-3.5S2.55 3 4 3h4c1.45 0 3 1.69 3 3.5 0 1.41-.91 2.72-2 3.25V8.59c.58-.45 1-1.27 1-2.09C10 5.22 8.98 4 8 4H4c-.98 0-2 1.22-2 2.5S3 9 4 9zm9-3h-1v1h1c1 0 2 1.22 2 2.5S13.98 12 13 12H9c-.98 0-2-1.22-2-2.5 0-.83.42-1.64 1-2.09V6.25c-1.09.53-2 1.84-2 3.25C6 11.31 7.55 13 9 13h4c1.45 0 3-1.69 3-3.5S14.5 6 13 6z\"\n  }))), \"Reviewing Generated Specification\"), mdx(\"p\", null, \"In our editor's \", mdx(\"em\", {\n    parentName: \"p\"\n  }, \"Specification\"), \" tab, we'll now have the following \", mdx(OutboundLink, {\n    href: \"http://vega.github.io/vega-lite/docs/spec.html\",\n    target: \"_blank\",\n    mdxType: \"OutboundLink\"\n  }, \"Vega-Lite JSON specification\"), \":\"), mdx(\"pre\", null, mdx(\"code\", {\n    parentName: \"pre\",\n    \"className\": \"language-json\"\n  }, \"{\\n    \\\"data\\\": { \\\"name\\\": \\\"dataset\\\" },\\n    \\\"mark\\\": {\\n        \\\"type\\\": \\\"bar\\\",\\n        \\\"tooltip\\\": true\\n    },\\n    \\\"encoding\\\": {\\n        \\\"y\\\": {\\n            \\\"field\\\": \\\"City\\\",\\n            \\\"type\\\": \\\"nominal\\\"\\n        },\\n        \\\"x\\\": {\\n            \\\"field\\\": \\\"Mean Temperature\\\",\\n            \\\"type\\\": \\\"quantitative\\\"\\n        },\\n        \\\"opacity\\\": {\\n            \\\"condition\\\": {\\n                \\\"test\\\": {\\n                    \\\"field\\\": \\\"__selected__\\\",\\n                    \\\"equal\\\": \\\"off\\\"\\n                },\\n                \\\"value\\\": 0.3\\n            }\\n        }\\n    }\\n}\\n\")), mdx(\"p\", null, \"Here, we can see that:\"), mdx(\"ul\", null, mdx(\"li\", {\n    parentName: \"ul\"\n  }, mdx(\"p\", {\n    parentName: \"li\"\n  }, \"There's a \", mdx(\"inlineCode\", {\n    parentName: \"p\"\n  }, \"data\"), \" object, which has a mapping of \", mdx(\"inlineCode\", {\n    parentName: \"p\"\n  }, \"\\\"dataset\\\"\"), \".\"), mdx(\"ul\", {\n    parentName: \"li\"\n  }, mdx(\"li\", {\n    parentName: \"ul\"\n  }, \"This is required for the specification, instructs that our visual's dataset should be used and should be left as-is.\"), mdx(\"li\", {\n    parentName: \"ul\"\n  }, \"Refer to the \", mdx(\"a\", {\n    parentName: \"li\",\n    \"href\": \"./visual-dataset-binding\"\n  }, \"Visual Dataset Binding\"), \" page for more details on how this works.\"))), mdx(\"li\", {\n    parentName: \"ul\"\n  }, mdx(\"p\", {\n    parentName: \"li\"\n  }, \"We're \", mdx(OutboundLink, {\n    href: \"http://vega.github.io/vega-lite/docs/bar.html\",\n    target: \"_blank\",\n    mdxType: \"OutboundLink\"\n  }, \"using a \", mdx(\"inlineCode\", {\n    parentName: \"p\"\n  }, \"bar\"), \" mark\"), \" for our data point and we're displaying a \", mdx(\"inlineCode\", {\n    parentName: \"p\"\n  }, \"tooltip\"), \" for this mark.\")), mdx(\"li\", {\n    parentName: \"ul\"\n  }, mdx(\"p\", {\n    parentName: \"li\"\n  }, \"The \", mdx(OutboundLink, {\n    href: \"http://vega.github.io/vega-lite/docs/encoding.html\",\n    target: \"_blank\",\n    mdxType: \"OutboundLink\"\n  }, \"encoding for the visual\"), \" maps our data as follows:\"), mdx(\"ul\", {\n    parentName: \"li\"\n  }, mdx(\"li\", {\n    parentName: \"ul\"\n  }, mdx(\"inlineCode\", {\n    parentName: \"li\"\n  }, \"City\"), \" is mapped to the y-axis.\"), mdx(\"li\", {\n    parentName: \"ul\"\n  }, mdx(\"inlineCode\", {\n    parentName: \"li\"\n  }, \"Mean Temperature\"), \" is mapped to the x-axis.\"), mdx(\"li\", {\n    parentName: \"ul\"\n  }, \"The opacity of our mark is linked to a special field called \", mdx(\"inlineCode\", {\n    parentName: \"li\"\n  }, \"__selected__\"), \", which manages cross-filtering for us. This is explained further below, so just bear with us for now.\")))), mdx(\"p\", null, \"This is a simple \", mdx(OutboundLink, {\n    href: \"http://vega.github.io/vega-lite/docs/spec.html#single\",\n    target: \"_blank\",\n    mdxType: \"OutboundLink\"\n  }, \"single view specification\"), \", so once you're comfortable with the syntax, you should be able to move onto \", mdx(OutboundLink, {\n    href: \"https://vega.github.io/vega-lite/docs/layer.html\",\n    target: \"_blank\",\n    mdxType: \"OutboundLink\"\n  }, \"layered\"), \", \", mdx(OutboundLink, {\n    href: \"https://vega.github.io/vega-lite/docs/concat.html\",\n    target: \"_blank\",\n    mdxType: \"OutboundLink\"\n  }, \"concatenated\"), \" or \", mdx(OutboundLink, {\n    href: \"https://vega.github.io/vega-lite/docs/facet.html\",\n    target: \"_blank\",\n    mdxType: \"OutboundLink\"\n  }, \"faceted\"), \" views in no time \\uD83D\\uDE09\"), mdx(\"p\", null, \"We also have some other stuff going on in the editor's \", mdx(\"em\", {\n    parentName: \"p\"\n  }, \"Config\"), \" tab, thanks to our template...\"), mdx(\"h2\", {\n    \"id\": \"reviewing-generated-config\",\n    \"style\": {\n      \"position\": \"relative\"\n    }\n  }, mdx(\"a\", {\n    parentName: \"h2\",\n    \"href\": \"#reviewing-generated-config\",\n    \"aria-label\": \"reviewing generated config permalink\",\n    \"className\": \"anchor before\"\n  }, mdx(\"svg\", {\n    parentName: \"a\",\n    \"aria-hidden\": \"true\",\n    \"focusable\": \"false\",\n    \"height\": \"16\",\n    \"version\": \"1.1\",\n    \"viewBox\": \"0 0 16 16\",\n    \"width\": \"16\"\n  }, mdx(\"path\", {\n    parentName: \"svg\",\n    \"fillRule\": \"evenodd\",\n    \"d\": \"M4 9h1v1H4c-1.5 0-3-1.69-3-3.5S2.55 3 4 3h4c1.45 0 3 1.69 3 3.5 0 1.41-.91 2.72-2 3.25V8.59c.58-.45 1-1.27 1-2.09C10 5.22 8.98 4 8 4H4c-.98 0-2 1.22-2 2.5S3 9 4 9zm9-3h-1v1h1c1 0 2 1.22 2 2.5S13.98 12 13 12H9c-.98 0-2-1.22-2-2.5 0-.83.42-1.64 1-2.09V6.25c-1.09.53-2 1.84-2 3.25C6 11.31 7.55 13 9 13h4c1.45 0 3-1.69 3-3.5S14.5 6 13 6z\"\n  }))), \"Reviewing Generated Config\"), mdx(\"p\", null, \"In our editor's \", mdx(\"em\", {\n    parentName: \"p\"\n  }, \"Config\"), \" tab, we'll have the following \", mdx(OutboundLink, {\n    href: \"http://vega.github.io/vega-lite/docs/config.html\",\n    target: \"_blank\",\n    mdxType: \"OutboundLink\"\n  }, \"Vega-Lite JSON configuration\"), \":\"), mdx(\"pre\", null, mdx(\"code\", {\n    parentName: \"pre\",\n    \"className\": \"language-json\"\n  }, \"{\\n    \\\"autosize\\\": {\\n        \\\"type\\\": \\\"fit\\\",\\n        \\\"contains\\\": \\\"padding\\\"\\n    }\\n}\\n\")), mdx(\"p\", null, \"This is a nice feature of Vega-Lite that provides \", mdx(OutboundLink, {\n    href: \"http://vega.github.io/vega-lite/docs/size.html#autosize\",\n    target: \"_blank\",\n    mdxType: \"OutboundLink\"\n  }, \"automatic sizing for simpler (single or layered) views\"), \", so has been included in this template by default.\"), mdx(\"p\", null, \"You can extend the config significantly to customize many parts of your visual, so it's worth diving into the \", mdx(OutboundLink, {\n    href: \"http://vega.github.io/vega-lite/docs/config.html\",\n    target: \"_blank\",\n    mdxType: \"OutboundLink\"\n  }, \"documentation for this\"), \" when you're ready.\"), mdx(\"blockquote\", null, mdx(\"p\", {\n    parentName: \"blockquote\"\n  }, mdx(\"em\", {\n    parentName: \"p\"\n  }, \"You can include your \", mdx(\"inlineCode\", {\n    parentName: \"em\"\n  }, \"config\"), \" in the specification JSON if you like at the top-level, but the intention here is to separate the cosmetic aspects of the visual away from its logical ones, so we have a separate tab in the editor for this for thos who wish to adopt this approach.\"))), mdx(\"h2\", {\n    \"id\": \"tooltips\",\n    \"style\": {\n      \"position\": \"relative\"\n    }\n  }, mdx(\"a\", {\n    parentName: \"h2\",\n    \"href\": \"#tooltips\",\n    \"aria-label\": \"tooltips permalink\",\n    \"className\": \"anchor before\"\n  }, mdx(\"svg\", {\n    parentName: \"a\",\n    \"aria-hidden\": \"true\",\n    \"focusable\": \"false\",\n    \"height\": \"16\",\n    \"version\": \"1.1\",\n    \"viewBox\": \"0 0 16 16\",\n    \"width\": \"16\"\n  }, mdx(\"path\", {\n    parentName: \"svg\",\n    \"fillRule\": \"evenodd\",\n    \"d\": \"M4 9h1v1H4c-1.5 0-3-1.69-3-3.5S2.55 3 4 3h4c1.45 0 3 1.69 3 3.5 0 1.41-.91 2.72-2 3.25V8.59c.58-.45 1-1.27 1-2.09C10 5.22 8.98 4 8 4H4c-.98 0-2 1.22-2 2.5S3 9 4 9zm9-3h-1v1h1c1 0 2 1.22 2 2.5S13.98 12 13 12H9c-.98 0-2-1.22-2-2.5 0-.83.42-1.64 1-2.09V6.25c-1.09.53-2 1.84-2 3.25C6 11.31 7.55 13 9 13h4c1.45 0 3-1.69 3-3.5S14.5 6 13 6z\"\n  }))), \"Tooltips\"), mdx(\"p\", null, \"Our template enables tooltips by default, so we can hover over a data point in our visual and this will display a default tooltip, e.g.:\"), mdx(\"p\", null, mdx(\"img\", {\n    parentName: \"p\",\n    \"src\": \"/images/getting-started/standard-tooltip.png\",\n    \"alt\": \"standard-tooltip.png\",\n    \"title\": \"If specifying that a mark should render a tooltip, this will display a standard Power BI tooltip when hovered.\"\n  })), mdx(\"h2\", {\n    \"id\": \"super-charging-tooltips\",\n    \"style\": {\n      \"position\": \"relative\"\n    }\n  }, mdx(\"a\", {\n    parentName: \"h2\",\n    \"href\": \"#super-charging-tooltips\",\n    \"aria-label\": \"super charging tooltips permalink\",\n    \"className\": \"anchor before\"\n  }, mdx(\"svg\", {\n    parentName: \"a\",\n    \"aria-hidden\": \"true\",\n    \"focusable\": \"false\",\n    \"height\": \"16\",\n    \"version\": \"1.1\",\n    \"viewBox\": \"0 0 16 16\",\n    \"width\": \"16\"\n  }, mdx(\"path\", {\n    parentName: \"svg\",\n    \"fillRule\": \"evenodd\",\n    \"d\": \"M4 9h1v1H4c-1.5 0-3-1.69-3-3.5S2.55 3 4 3h4c1.45 0 3 1.69 3 3.5 0 1.41-.91 2.72-2 3.25V8.59c.58-.45 1-1.27 1-2.09C10 5.22 8.98 4 8 4H4c-.98 0-2 1.22-2 2.5S3 9 4 9zm9-3h-1v1h1c1 0 2 1.22 2 2.5S13.98 12 13 12H9c-.98 0-2-1.22-2-2.5 0-.83.42-1.64 1-2.09V6.25c-1.09.53-2 1.84-2 3.25C6 11.31 7.55 13 9 13h4c1.45 0 3-1.69 3-3.5S14.5 6 13 6z\"\n  }))), \"Super-Charging Tooltips\"), mdx(\"p\", null, \"If we were to set up a tooltip page that included one of the columns from our visual, like this one (which displays the mean temperature over time, which is a bit more useful):\"), mdx(\"p\", null, mdx(\"img\", {\n    parentName: \"p\",\n    \"src\": \"/images/getting-started/tooltip-page-setup.png\",\n    \"alt\": \"tooltip-page-setup.png\",\n    \"title\": \"Setting up a simple tooltip page for the 'City' column.\"\n  })), mdx(\"p\", null, \"Then, the visual can resolve this, providing that you specify to use a report page tooltip instead of a default one, e.g.:\"), mdx(\"p\", null, mdx(\"img\", {\n    parentName: \"p\",\n    \"src\": \"/images/getting-started/canvas-tooltip.png\",\n    \"alt\": \"canvas-tooltip.png\",\n    \"title\": \"Report page tooltips can be displayed if a suitable match can be found for your data point.\"\n  })), mdx(\"blockquote\", null, mdx(\"p\", {\n    parentName: \"blockquote\"\n  }, mdx(\"em\", {\n    parentName: \"p\"\n  }, \"Note that report page tooltips will only work if your data point hasn't been transformed or mutated from the row context passed-into your visual's dataset. In the cases where data points cannot be reconciled back to the data model, the visual will display a default tooltip instead. Please refer to the \", mdx(\"a\", {\n    parentName: \"em\",\n    \"href\": \"/interactivity-features-overview\"\n  }, \"Interactivity Features\"), \" or \", mdx(\"a\", {\n    parentName: \"em\",\n    \"href\": \"/interactivity-tooltips\"\n  }, \"Tooltips\"), \" pages for further details.\"))), mdx(\"h2\", {\n    \"id\": \"cross-filtering\",\n    \"style\": {\n      \"position\": \"relative\"\n    }\n  }, mdx(\"a\", {\n    parentName: \"h2\",\n    \"href\": \"#cross-filtering\",\n    \"aria-label\": \"cross filtering permalink\",\n    \"className\": \"anchor before\"\n  }, mdx(\"svg\", {\n    parentName: \"a\",\n    \"aria-hidden\": \"true\",\n    \"focusable\": \"false\",\n    \"height\": \"16\",\n    \"version\": \"1.1\",\n    \"viewBox\": \"0 0 16 16\",\n    \"width\": \"16\"\n  }, mdx(\"path\", {\n    parentName: \"svg\",\n    \"fillRule\": \"evenodd\",\n    \"d\": \"M4 9h1v1H4c-1.5 0-3-1.69-3-3.5S2.55 3 4 3h4c1.45 0 3 1.69 3 3.5 0 1.41-.91 2.72-2 3.25V8.59c.58-.45 1-1.27 1-2.09C10 5.22 8.98 4 8 4H4c-.98 0-2 1.22-2 2.5S3 9 4 9zm9-3h-1v1h1c1 0 2 1.22 2 2.5S13.98 12 13 12H9c-.98 0-2-1.22-2-2.5 0-.83.42-1.64 1-2.09V6.25c-1.09.53-2 1.84-2 3.25C6 11.31 7.55 13 9 13h4c1.45 0 3-1.69 3-3.5S14.5 6 13 6z\"\n  }))), \"Cross-Filtering\"), mdx(\"p\", null, \"Many Power BI visuals allow you to cross-filter others by clicking (or Ctrl-clicking data points). We can also do this with Deneb, but there are elements of user experience that we need to consider: most Power BI visuals will dim or fade the un-selected data points so that our users understand what is happening between our visual and others.\"), mdx(\"p\", null, \"This is normally opt-in, but our template already has a simple version of this set-up already. The relevant section of our specification is on lines 16 through 24:\"), mdx(\"pre\", null, mdx(\"code\", {\n    parentName: \"pre\",\n    \"className\": \"language-json\"\n  }, \"{\\n    \\\"opacity\\\": {\\n      \\\"condition\\\": {\\n        \\\"test\\\": {\\n          \\\"field\\\": \\\"__selected__\\\",\\n          \\\"equal\\\": \\\"off\\\"\\n        },\\n        \\\"value\\\": 0.3\\n    }\\n}\\n\")), mdx(\"p\", null, \"Deneb uses a special field called \", mdx(\"inlineCode\", {\n    parentName: \"p\"\n  }, \"__selected__\"), \" to track the status of each row of our dataset. We can use this in our \", mdx(\"inlineCode\", {\n    parentName: \"p\"\n  }, \"encoding\"), \", along with a \", mdx(\"inlineCode\", {\n    parentName: \"p\"\n  }, \"test\"), \" to set the \", mdx(\"inlineCode\", {\n    parentName: \"p\"\n  }, \"opacity\"), \" value of our mark to \", mdx(\"inlineCode\", {\n    parentName: \"p\"\n  }, \"0.3\"), \" (or 30%) if it is not one of those that we've clicked (or Ctrl-clicked) on, e.g.:\"), mdx(\"p\", null, mdx(\"img\", {\n    parentName: \"p\",\n    \"src\": \"/images/getting-started/cross-filtering-opacity.png\",\n    \"alt\": \"cross-filtering-opacity.png\",\n    \"title\": \"We can use Cross-Filtering .\"\n  })), mdx(\"blockquote\", null, mdx(\"p\", {\n    parentName: \"blockquote\"\n  }, mdx(\"em\", {\n    parentName: \"p\"\n  }, \"Note that much like report page tooltips, Cross-Filtering will only work well if your data point hasn't been transformed or mutated from the row context passed-into your visual's dataset. In the cases where data points cannot be reconciled back to the data model, this may not work as intended. You also need to manage the visual effects of your selected and un-selected marks. Please refer to the \", mdx(\"a\", {\n    parentName: \"em\",\n    \"href\": \"/interactivity-features-overview\"\n  }, \"Interactivity Features\"), \" or \", mdx(\"a\", {\n    parentName: \"em\",\n    \"href\": \"/interactivity-selection\"\n  }, \"Cross-Filtering (Selection)\"), \" pages for further details.\"))), mdx(\"h2\", {\n    \"id\": \"adding-further-config\",\n    \"style\": {\n      \"position\": \"relative\"\n    }\n  }, mdx(\"a\", {\n    parentName: \"h2\",\n    \"href\": \"#adding-further-config\",\n    \"aria-label\": \"adding further config permalink\",\n    \"className\": \"anchor before\"\n  }, mdx(\"svg\", {\n    parentName: \"a\",\n    \"aria-hidden\": \"true\",\n    \"focusable\": \"false\",\n    \"height\": \"16\",\n    \"version\": \"1.1\",\n    \"viewBox\": \"0 0 16 16\",\n    \"width\": \"16\"\n  }, mdx(\"path\", {\n    parentName: \"svg\",\n    \"fillRule\": \"evenodd\",\n    \"d\": \"M4 9h1v1H4c-1.5 0-3-1.69-3-3.5S2.55 3 4 3h4c1.45 0 3 1.69 3 3.5 0 1.41-.91 2.72-2 3.25V8.59c.58-.45 1-1.27 1-2.09C10 5.22 8.98 4 8 4H4c-.98 0-2 1.22-2 2.5S3 9 4 9zm9-3h-1v1h1c1 0 2 1.22 2 2.5S13.98 12 13 12H9c-.98 0-2-1.22-2-2.5 0-.83.42-1.64 1-2.09V6.25c-1.09.53-2 1.84-2 3.25C6 11.31 7.55 13 9 13h4c1.45 0 3-1.69 3-3.5S14.5 6 13 6z\"\n  }))), \"Adding Further Config\"), mdx(\"p\", null, \"It's possible to make our visual look a bit more at home, but also unique in its own right by adding or modifying its configuration, so let's select the \", mdx(\"em\", {\n    parentName: \"p\"\n  }, \"Config\"), \" tab and update this as follows (changes highlighted):\"), mdx(\"pre\", null, mdx(\"code\", {\n    parentName: \"pre\",\n    \"className\": \"language-json\",\n    \"metastring\": \"highlight={6-25}\",\n    \"highlight\": \"{6-25}\"\n  }, \"{\\n    \\\"autosize\\\": {\\n        \\\"type\\\": \\\"fit\\\",\\n        \\\"contains\\\": \\\"padding\\\"\\n    },\\n    \\\"view\\\": { \\\"stroke\\\": \\\"transparent\\\" },\\n    \\\"font\\\": \\\"Segoe UI\\\",\\n    \\\"bar\\\": {\\n        \\\"color\\\": \\\"#605E5C\\\",\\n        \\\"cornerRadiusTopRight\\\": 10,\\n        \\\"cornerRadiusBottomRight\\\": 10\\n    },\\n    \\\"axis\\\": {\\n        \\\"domain\\\": false,\\n        \\\"labelColor\\\": \\\"#605E5C\\\",\\n        \\\"labelFontSize\\\": 12,\\n        \\\"labelPadding\\\": 5,\\n        \\\"ticks\\\": false,\\n        \\\"tickCount\\\": 5,\\n        \\\"titleFontSize\\\": 14,\\n        \\\"titleFontWeight\\\": \\\"bold\\\",\\n        \\\"titleColor\\\": \\\"#605E5C\\\",\\n        \\\"gridDash\\\": [1, 5],\\n        \\\"gridColor\\\": \\\"#605E5C\\\"\\n    }\\n}\\n\")), mdx(\"p\", null, \"We can apply our changes by clicking the \", mdx(\"em\", {\n    parentName: \"p\"\n  }, \"Apply\"), \" command, or pressing \", mdx(\"strong\", {\n    parentName: \"p\"\n  }, \"[ Ctrl + Enter ]\"), \":\"), mdx(\"p\", null, mdx(\"img\", {\n    parentName: \"p\",\n    \"src\": \"/images/getting-started/apply-command.png\",\n    \"alt\": \"apply-command.png\",\n    \"title\": \"The 'Apply' command ensures your changes are applied to the visual specification.\"\n  })), mdx(\"blockquote\", null, mdx(\"p\", {\n    parentName: \"blockquote\"\n  }, mdx(\"em\", {\n    parentName: \"p\"\n  }, \"Note that the \", mdx(\"strong\", {\n    parentName: \"em\"\n  }, \"Auto-Apply\"), \" command can be used to ensure changes are applied as you type rather than manually, although this isn't recommended for complex specifications or ones that use a large number of data points.\"))), mdx(\"p\", null, \"Once we've applied the changes, our visual updates as follows:\"), mdx(\"p\", null, mdx(\"img\", {\n    parentName: \"p\",\n    \"src\": \"/images/getting-started/config-applied.png\",\n    \"alt\": \"config-applied.png\",\n    \"title\": \"Visual after config has been applied.\"\n  })), mdx(\"h2\", {\n    \"id\": \"viewing-the-finished-product\",\n    \"style\": {\n      \"position\": \"relative\"\n    }\n  }, mdx(\"a\", {\n    parentName: \"h2\",\n    \"href\": \"#viewing-the-finished-product\",\n    \"aria-label\": \"viewing the finished product permalink\",\n    \"className\": \"anchor before\"\n  }, mdx(\"svg\", {\n    parentName: \"a\",\n    \"aria-hidden\": \"true\",\n    \"focusable\": \"false\",\n    \"height\": \"16\",\n    \"version\": \"1.1\",\n    \"viewBox\": \"0 0 16 16\",\n    \"width\": \"16\"\n  }, mdx(\"path\", {\n    parentName: \"svg\",\n    \"fillRule\": \"evenodd\",\n    \"d\": \"M4 9h1v1H4c-1.5 0-3-1.69-3-3.5S2.55 3 4 3h4c1.45 0 3 1.69 3 3.5 0 1.41-.91 2.72-2 3.25V8.59c.58-.45 1-1.27 1-2.09C10 5.22 8.98 4 8 4H4c-.98 0-2 1.22-2 2.5S3 9 4 9zm9-3h-1v1h1c1 0 2 1.22 2 2.5S13.98 12 13 12H9c-.98 0-2-1.22-2-2.5 0-.83.42-1.64 1-2.09V6.25c-1.09.53-2 1.84-2 3.25C6 11.31 7.55 13 9 13h4c1.45 0 3-1.69 3-3.5S14.5 6 13 6z\"\n  }))), \"Viewing the Finished Product\"), mdx(\"p\", null, \"When you're finished, click on \", mdx(\"em\", {\n    parentName: \"p\"\n  }, \"Back to report\"), \" to bring you back out of focus mode and to the report canvas. Our visual will now be 'regular sized', thanks to the \", mdx(\"inlineCode\", {\n    parentName: \"p\"\n  }, \"autosize\"), \" configuration we applied earlier on:\"), mdx(\"p\", null, mdx(\"img\", {\n    parentName: \"p\",\n    \"src\": \"/images/getting-started/regular-sized-bar.png\",\n    \"alt\": \"regular-sized-bar.png\",\n    \"title\": \"Exiting focus mode returns the visual back to standard size.\"\n  })), mdx(\"h2\", {\n    \"id\": \"where-next\",\n    \"style\": {\n      \"position\": \"relative\"\n    }\n  }, mdx(\"a\", {\n    parentName: \"h2\",\n    \"href\": \"#where-next\",\n    \"aria-label\": \"where next permalink\",\n    \"className\": \"anchor before\"\n  }, mdx(\"svg\", {\n    parentName: \"a\",\n    \"aria-hidden\": \"true\",\n    \"focusable\": \"false\",\n    \"height\": \"16\",\n    \"version\": \"1.1\",\n    \"viewBox\": \"0 0 16 16\",\n    \"width\": \"16\"\n  }, mdx(\"path\", {\n    parentName: \"svg\",\n    \"fillRule\": \"evenodd\",\n    \"d\": \"M4 9h1v1H4c-1.5 0-3-1.69-3-3.5S2.55 3 4 3h4c1.45 0 3 1.69 3 3.5 0 1.41-.91 2.72-2 3.25V8.59c.58-.45 1-1.27 1-2.09C10 5.22 8.98 4 8 4H4c-.98 0-2 1.22-2 2.5S3 9 4 9zm9-3h-1v1h1c1 0 2 1.22 2 2.5S13.98 12 13 12H9c-.98 0-2-1.22-2-2.5 0-.83.42-1.64 1-2.09V6.25c-1.09.53-2 1.84-2 3.25C6 11.31 7.55 13 9 13h4c1.45 0 3-1.69 3-3.5S14.5 6 13 6z\"\n  }))), \"Where Next?\"), mdx(\"p\", null, \"We've used one of the inbuilt templates to produce a simple example, and add some integration features in the form of tooltips, and customized its appearance using config. A simple visual like this is just the tip of the iceberg and the way ahead is quite broad and expansive.\"), mdx(\"p\", null, \"The purpose of this site is to provide detail on how to make the visual work for you within Power BI, rather than repeating the wealth of great documentation that's already out there. To learn more about some of the additional things the visual can offer (or understand some of its limitations) then please continue to read on or use the menu to explore further.\"), mdx(\"p\", null, \"If you're hungry for more examples or further inspiration, then a good place to start is \", mdx(OutboundLink, {\n    href: \"http://vega.github.io/vega-lite/examples/\",\n    target: \"_blank\",\n    mdxType: \"OutboundLink\"\n  }, \"Vega-Lite's own gallery\"), \", or even \", mdx(OutboundLink, {\n    href: \"https://vega.github.io/vega/examples/\",\n    target: \"_blank\",\n    mdxType: \"OutboundLink\"\n  }, \"Vega's gallery\"), \".\"));\n}\n;\nMDXContent.isMDXComponent = true;","headings":[{"depth":2,"value":"Sample Data"},{"depth":2,"value":"Adding the Visual"},{"depth":2,"value":"Adding the Data"},{"depth":2,"value":"Opening the Editor"},{"depth":2,"value":"Selecting the Template"},{"depth":2,"value":"Assigning Placeholders"},{"depth":2,"value":"Creating the Initial Specification"},{"depth":2,"value":"Reviewing Generated Specification"},{"depth":2,"value":"Reviewing Generated Config"},{"depth":2,"value":"Tooltips"},{"depth":2,"value":"Super-Charging Tooltips"},{"depth":2,"value":"Cross-Filtering"},{"depth":2,"value":"Adding Further Config"},{"depth":2,"value":"Viewing the Finished Product"},{"depth":2,"value":"Where Next?"}]}},"pageContext":{"slug":"/simple-worked-example/","prev":{"label":"Getting Deneb","link":"/installation"},"next":{"label":"Visual Dataset Binding","link":"/visual-dataset-binding"},"repositoryEditUrl":"https://github.com/deneb-viz/deneb-viz.github.io/tree/source/src/docs/simple-worked-example.mdx","repositoryProvider":"GitHub"}},
    "staticQueryHashes": ["1954253342","2328931024","2501019404","973074209"]}